,요리명
962,찹쌀밥 맑은순살아귀탕 매운돼지갈비찜 삼색나물무침 양념장 깍두기 조각파인애플
963,깍두기참치볶음밥 달걀후라이 모듬어묵국 우리밀허니카스테라 토네이도소시지구이 찐만두 초코두유
964,차조쌀밥 표고미역국 장각구이 마파어두부덮밥소스 석박지 메로나튜브
965,찹쌀밥 옥수수스프 쫄면야채무침 통등심돈까스 깍두기 수제후르츠요거트
966,찹쌀밥 로키로드쿠키 감자짜글이찌개 쇠고기장조림 동전쥐포볶음 짜요짜요
967,차수수밥 로제크림소스스파게티 오징어무국 수육 새우젓 석류무쌈 치커리사과무침 보쌈김치
968,오므라이스밥 지단 우동국물 알감자버터구이 배추김치 용가리치킨 머스터드 상하목장 유기농 요구르트
969,찹쌀밥 근대콩나물된장국 오리훈제 자장떡볶이 에이요요구르트 곡물그대로 깻잎무쌈
970,카레소스덮밥 우리밀마늘빵스틱 김치콩나물국 소보로회오리감자튀김 깍두기 워터젤리
971,찹쌀밥 등뼈감자탕 언양식바싹불고기 순살가자미카레튀김 석박지 사과
972,추가밥 김자반 죽 고구마케이크 무말랭이김치 스위트플럼주스 시리얼 
973,홍국쌀밥 얼갈이배추들깨국 애호박느타리버섯볶음 치즈떡볶이 통등심돈까스 배추김치 바나나
974,찹쌀밥 미소된장국 멸치견과류볶음 찐옥수수 김치볶음김가루 계란후라이 스팸구이 짜먹는요구르트
975,찹쌀밥 마들렌 쇠고기두부탕국 달걀장조림 총각김치 통살새우까스 워터젤리
976,기장쌀밥 구운도넛 황태감자달걀국 삼치살엿장조림 연탄오리불고기 파채 깻잎 깍두기
977,흑미밥 수제피자핫도그 차승원표닭곰탕 당면사리 영양갈비찜 도토리묵무침 석박지
978,날치알스팸김치볶음밥 찹쌀쫀도그 떡만두국 무말랭이김치 김구이 엔요
979,콩나물밥 양념장 두부김치국 크리미어니언수제치킨 열무김치 무지개떡 멜론
980,삼색소보로덮밥 쇠고기미역국 의성마늘 고기왕 만두 깍두기 빠삐코 초간장
981,달걀밥 참치김치찌개 뮤즐리멸치볶음 싸먹는햄 콘치즈마약옥수수사각피자 배추겉절이
982,혼합팔곡 유부김가루국 양념깻잎지 돈육검은깨두부조림 달걀말이 총각김치 골드파인애플
983,찹쌀밥 우렁된장찌개 오향장육 비빔막국수 보쌈김치 딸기우유
984,추가밥 김자반 어묵우동 파운드초코 치즈스틱 케첩 꼬들단무지 보쌈김치 플리또
985,현미찹쌀밥 대패고추장불고기 우렁두부된장찌개 곤드레나물잡채 보쌈김치 수제카레난치즈피자
986,흑미밥 쇠고기당면국 부추발사믹샐러드 오리훈제구이 머스터드 레몬무쌈 배추김치 도시락김
987,밥 볶음김치 스팸구이 김가루 맑은콩나물국 스트링치즈어묵바 후르츠생크림모닝빵 아침에주스
988,찹쌀밥 쫄면채소무침 만두육개장 아삭이고추쌈장무침 깍두기 리얼통살생선가스 엔요
989,찹쌀밥 자장면 짬뽕국 꼬들무채장아찌 닭장각오븐구이 배추김치
990,찹쌀밥 등뼈우거지국 카레감자햄볶음 갈릭후레이크떡말이 검은콩두유 바나나
991,삼선자장덮밥 달걀부추국 참나물고추장무침 깍두기 오렌지주스 수제치킨퀘사디아
992,찹쌀밥 미니팬케이크 메이플시럽 부대찌개 찹스테이크감자조림 청포묵김가루무침 석박지
993,김밥볶음밥 에그머핀 아욱수제비국 소떡꼬치 깍두기 가나초콜렛우유
994,산채비빔밥 열무된장국 한우약고추장 달걀후라이 고구마땅콩맛탕 열무김치 워터젤리
995,흑미밥 우렁된장찌개 파프리카잡채 제육고추장볶음 레몬무쌈 보쌈김치 짜먹는요구르트
996,찹쌀밥 참치김치찌개 수제언양식숯불고기 깻잎채 뱅어포구이 총각김치 딸기우유 스마일약과
997,찰보리밥 아귀맑은탕 열무비빔냉면 김치치즈함박스테이크 깍두기 플리또
998,찹쌀밥 등뼈감자탕 달걀장조림 치즈떡 비엔나케첩볶음 석박지 조각파인애플
999,찹쌀밥 오징어무국 달걀찜 초코몬드 치즈닭갈비 깍두기 아이러브요거트 마쉬멜로
1000,찰옥수수밥 오색옹심이미역국 콩나물부추무침 새송이 통마늘구이 돈오븐구이 배추김치 사과
1001,찹쌀밥 김치콩나물국 진미채엿장조림 비엔나치즈떡볶음 미숫가루 딸기아이스찰떡
1002,차조쌀밥 우리밀우리쌀초코파이 쇠고기미역국 돼지갈비김치떡찜 부추잡채 찹쌀콩멸치볶음 총각김치
1003,죽 해물볶음우동 해쉬브라운 깍두기 오렌지주스 쇼콜라 아몬드쿠키
1004,찹쌀밥 대패고추장불고기 몽글순두부짬뽕탕 숙주맛살무침 배추김치 에그타르트 플리또
1005,홍국쌀밥 황태감자달걀국 노각무침 자장떡볶이 노랑만두깐쇼새우튀김 배추김치 방울토마토
1006,찹쌀밥 미소된장국 토마토스파게티 양념닭강정 배추김치 짜먹는요구르트
1007,죽 햄치즈샌드위치 깍두기 혼합시리얼 엔요 부드러운와플
1008,불닭마요덮밥 우동국물 라이스틱 깍두기 초코설기 골드파인애플
1009,현미찹쌀밥 설렁탕 순대야채볶음 석박지 연두부찜 양념장 포도푸딩
1010,찹쌀밥 로키로드쿠키 부대찌개 석류무쌈 오리훈제 머스터드 무말랭이김치 짜요짜요
1011,찰보리밥 등뼈우거지국 골뱅이무침 소면 저염고등어카레구이 석박지 상큼한사과주스
1012,오므라이스밥 지단 건새우무국 오색피클 갈떡궁합꼬치 배추김치 딸기요플레
1013,찹쌀밥 떡국 갈릭크로와상 카레감자햄볶음 오징어김치전 석박지 후룻볼
1014,차수수밥 닭개장 도토리묵김치무침 미역줄기맛살볶음 수제언양식숯불고기 깻잎채 깍두기 골드키위
1015,흑미밥 짬뽕국 토마토소스등갈비구이 달걀말이 백김치 도시락김
1016,찹쌀밥 파운드초코 돼지갈비김치찌개 비엔나치즈떡볶음 소보로치킨텐더 머스터드 열무김치 제주감귤주스
1017,버섯카로틴쌀밥 부대찌개 삼치살엿장조림 충무식오징어 어묵무침 총각김치 호밀사과파이
1018,새우살볶음밥 쇠고기미역국 크리미어니언수제치킨 꼬치없는 떡꼬치 깍두기 조각파인애플
1019,찹쌀밥 떡만두국 달걀장조림 피자치즈롤가스 석박지 콘시리얼바견과바 복숭아음료
1020,기장쌀밥 참치김치찌개 안동찜닭 해물우동볶음 동치미 짜요짜요
1021,흑미밥 순두부백탕 한돈수육 비빔막국수 아삭이고추된장무침 보쌈김치 석류쌈무
1022,날치알스팸김치볶음밥 김가루 팽이버섯미소장국 닭다리살꼬치 동치미 바나나우유 감귤
1023,현미찹쌀밥 감자핫도그 유부김치국 마파어두부덮밥소스 석박지 사과
1024,참치김치치즈밥버거 떡국 알감자버터구이 양파장아찌 깍두기 상하목장 유기농 요구르트
1025,달걀밥 얼큰콩나물국 김치볶음 싸먹는햄 김구이 비요뜨
1026,강황쌀밥 아욱얼갈이수제비국 달걀찜 황도파인샐러드 키위D 베이컨감자채볶음 돈육버섯고추장불고기 열무김치
1027,"흑미밥 녹두닭곰탕 사태떡찜 ""월 제철 참나물""유자샐러드 고구마맛탕 석박지"
1028,찹쌀밥 김자반 죽 대만샌드위치 치즈떡볶이 깍두기 아침에주스
1029,어묵우동 수제통살치킨버거 깍두기 단무지 망고주스 바나나
1030,단호박카레라이스 우리쌀밤파운드 달걀부추국 두부송이고기완자 케첩 깍두기 아침에주스
1031,홍국쌀밥 쫄자장면 몽글순두부짬뽕탕 꼬들단무지무침 고구마치즈돈까스 깍두기 감귤후루츠푸딩
1032,흑미밥 참치김치찌개 두부구이돈양념 순살닭갈비 깍두기 딸기맛포켓팝콘
1033,찹쌀밥 가마보꼬어묵쑥갓탕 동전쥐포볶음 매콤돼지갈비떡찜 총각김치 곡물그대로 워터젤리
1034,차조쌀밥 육개장 오리훈제채소볶음 뱅어포구이 배추겉절이 꿀치즈토마토
1035,찹쌀밥 수제피자핫도그 순대돼지고기국 순살가자미카레튀김 석박지 귤
1036,콩나물밥 양념장 해물수제비국 스트링치즈어묵바 총각김치 딸기우유 메이플피칸파이
1037,찹쌀밥 크림스프 미트소스스파게티 배추김치 수제오이무피클 골드파인애플 뱅글뱅글소시지튀김
1038,도토리묵국 흑미밥 부추파절이 새송이 통마늘구이 한돈소금구이 보쌈김치 고추냉이쌈무 허쉬초코우유
1039,오므라이스 지단포함 레밍턴초코케이크 카레닭봉구이 석박지 엔요
1040,쥐눈이콩밥 대패간장불고기 우렁두부된장찌개 김치단무지어묵잡채 석박지 감귤
1041,흑미밥 떡국 매운돼지갈비찜 감자채햄볶음 배추김치 짜먹는요구르트
1042,밥 김치볶음 소시지구이 김가루 파인애플불고기피자 얼큰콩나물국 아이러브요거트 크런키초코스틱
1043,하이라이스 완두콩밥 맑은미역국 비름나물고추장무침 수제오징어링 단호박튀김 깍두기 캐플주스
1044,카레라이스 북어계란국 감자찐만두 초간장 새우튀김 깍두기
1045,찹쌀밥 티라미수케이크 감자짜글이찌개 연탄오리불고기 파채 깻잎 달걀말이 총각김치
1046,찰보리밥 도토리묵채국 수육 새우젓 녹차고추냉이무쌈 양파간장장아찌 콩나물부추무침 사케이요구르트
1047,쇠고기콩나물밥 들깨수제비국 김치피자탕수육 열무김치 카프리제토마토샐러드 파인애플주스
1048,찹쌀밥 우리밀허니카스테라 떡국 푸실리미트볼조림 보쌈김치 초코두유 김구이
1049,김밥멸치볶음밥 얼큰콩나물국 해물교자만두튀김 깍두기 송편 제주감귤주스
1050,찹쌀밥 우리밀마늘빵스틱 크림스프 김치볶음 돈까스 단무지 플리또 김구이
1051,흑미밥 우리밀초코칼슘조각케익 오색옹심이미역국 돼지갈비김치떡찜 햄달걀말이 배추김치
1052,흑미밥 꽃게찌개 맛살미역줄기볶음 한돈오븐구이 레몬쌈무 배추김치 딸기우유
1053,추가밥 김자반 어묵우동 감자고기찐만두 새우튀김 깍두기 곡물그대로 워터젤리
1054,혼합십곡밥 순두부연포탕 열무비빔냉면 곤드레나물무침 깻잎감자탕수육 보쌈김치 골드파인애플
1055,클로렐라쌀밥 돈육김치찌개 사태떡찜 순살고등어카레튀김 석박지 과일샐러드
1056,오징어덮밥 콩나물 김가루포함 우리밀찰핫도그 미소미역된장국 배추겉절이 머스캣음료 부드러운와플
1057,단호박카레라이스 수제피자핫도그 들깨무채국 깍두기 비피더스명장
1058,찹쌀밥 떡국 순살안동찜닭 양념깻잎지 청포묵김가루무침 배추김치
1059,찹쌀밥 고구마케이크 쇠고기두부탕국 햄달걀찜 스팸구이 불가리스
1060,강황쌀밥 치즈미트볼감자데리야끼조림 아욱수제비국 양상추샐러드 키위드레싱 도토리묵김치무침 무말랭이쪽파무침
1061,김자반밥 죽 우리밀마늘빵스틱 토마토스파게티 오이피클 최고야포도C주스
1062,찹쌀밥 열무된장국 연두부찜 양념장 돼지갈비떡찜 초코몬드 보쌈김치 비요뜨
1063,찰보리밥 오븐에구운도넛 부대찌개 장각구이 석박지 엔요
1064,찹쌀밥 들깨수제비국 눈꽃치즈샐러드 수제고구마튀김 오리훈제구이 머스터드 보쌈김치 고추냉이쌈무
1065,찹쌀밥 동태쑥갓탕 돈육메추리알장조림 스트링치즈산적 무말랭이김치 베리베리땡큐바 파인주스
1066,홍국쌀밥 육개장 우엉쌈장 콩나물부추무침 통등심돈까스 깍두기 파프리카스틱 아삭이고추 밥알없는식혜
1067,참치야채비빔밥 새알만두국 알감자버터구이 진미채간장조림 배추김치 증편g
1068,찹쌀밥 들깨수제비국 달걀장조림 수제등갈비구이 동치미 검은콩현미칩 사과주스
1069,통밀쌀밥 아욱감자된장국 오향장육 레몬무쌈 부추양배추무침 발사믹 새송이 통마늘구이 보쌈김치
1070,치킨마요덮밥 반반한핫도그 청양초콩나물국 단무지무침 배추김치 엔요
1071,카레새우볶음밥 청키초코수프림쿠키 두부김치국 스트링치즈어묵바 나박김치 플리또
1072,오징어덮밥 콩나물 김가루포함 바지락살두부새우젓국 들깨무나물 크리미어니언수제치킨 배추겉절이 카사바칩 비피더스명장
1073,흑미밥 건새우아욱된장국 매운돼지갈비찜 배추김치 연두부찜 양념장 직접갈은 바나나우유
1074,찹쌀밥 팡오쇼콜라 떡만두국 숙주맛살무침 피자치즈롤가스 포도주스
1075,기장쌀밥 감자짜글이찌개 연탄오리불고기 파채 깻잎 꽃맛살채소볶음 열무김치 상큼한사과주스 곡물그대로
1076,찹쌀밥 설렁탕 면사리 돈육메추리알장조림 오꼬노미야끼 석박지 조각파인애플
1077,찹쌀밥 대패간장불고기 닭곰탕 멸치고추장볶음 석박지 쁘띠첼 크런키초코스틱
1078,미트소스스파게티 혼합십삼곡밥 몽글순두부짬뽕탕 가자미살빵가루튀김 배추김치 감귤
1079,흑미밥 쇠고기부추영양탕 두부구이돈양념 파프리카잡채 보쌈김치 비요뜨 쿠키앤크림
1080,찹쌀밥 햄치즈샌드위치 북어감자국 자장떡볶이 칼슘고기완자 케첩 보쌈김치 망고주스
1081,단호박카로틴쌀밥 김치어묵국 숙주맛살무침 황도파인샐러드 딸기D 해쉬브라운 케첩 치즈함박 볶은채소 데미S 깍두기
1082,찹쌀밥 닭장각백숙 아삭이고추된장무침 오징어김치전 석박지 바람떡 도시락김
1083,찹쌀밥 쇠고기버섯무국 오리훈제 허니머스터드D 블루베리무쌈 햄스크램블드에그 무말랭이김치
1084,차조쌀밥 돼지갈비김치찌개 달걀찜 국물떡볶이 김말이튀김 총각김치 단팥빵
1085,자율밥김자반 잔치국수 브로콜리 초장 매콤치킨텐더 허니머스터드 배추겉절이 바나나
1086,오므라이스 지단포함 들깨무채국 응원리얼소시지바 머스터드 나박김치 식빵토스트 딸기쨈
1087,삼겹살날치알김치볶음밥 김가루 맑은콩나물국 양상추샐러드 오리엔탈D 달걀후라이 나박김치 캐플주스 메이플피칸파이
1088,기장밥 우렁된장찌개 오이스틱 쌈장 한돈수육 양파장아찌 애호박전 보쌈김치
1089,죽 어묵김치볶음 통살새우까스 곡물그대로 시리얼 요플레토핑
1090,모둠콩밥 꽃게탕 양배추참깨흑임자드레싱 돈육버섯고추장불고기 김치단무지어묵잡채 열무김치 골드파인애플
1091,불닭마요덮밥 미니크루아상 딸기쨈 순두부백탕 마카로니콘치즈구이 배추김치
1092,찹쌀밥 새알심미역국 연탄오리불고기 파채 깻잎 매콤콩나물무침 보쌈김치 검은콩두유 후르츠생크림모닝빵
1093,혼합팔곡 도토리묵채국 카레닭봉구이 골뱅이무침 소면 깍두기 방울토마토
1094,죽 튼튼햄버거 깍두기 회오리감자 오라떼
1095,찹쌀밥 달걀부추국 치킨너겟 머스터드 깍두기 자장덮밥소스 단팥빵 액티비아드링크
1096,흑미밥 해물볶음우동 등뼈김치우거지국 사과무생채 해물우동볶음 열무김치 포도주스 수제치킨퀘사디아
1097,돈가스덮밥 유부미소된장국 황도파인샐러드 키위D 수제씨앗호떡g 깍두기 엔요
1098,찹쌀밥 프렌치토스트 돼지갈비김치찌개 아몬드멸치볶음 수제언양식숯불고기 나박김치 딸기우유
1099,현미찹쌀밥 전주식순대국 아삭이고추쌈장무침 돈육검은깨두부조림 호박깻잎맛살감자전 총각김치 사과
1100,찹쌀밥 영양닭곰탕 스모그햄전 코다리강정 석박지 조각파인애플
1101,찹쌀밥 김자반 어묵우동 수제초코파이 소떡꼬치 단무지 그릭요거트
1102,김밥볶음밥 팽이버섯미소장국 배추김치 수제오븐치즈토스트 파인주스 절편
1103,강황쌀밥 연탄오리간장불고기 부추파절이 새송이 통마늘구이 두부김치국 열무김치 무지개떡
1104,찹쌀밥 블루베리머핀 스팸김치찌개 돈육데리야끼구이 오징어사과초무침 총각김치 바나나우유
1105,차수수밥 소면설렁탕 저염고등어무조림 순대채소볶음 애호박느타리버섯볶음 석박지 감귤
1106,삼겹살김치볶음밥 쇠고기미역국 고구마떡맛탕 깍두기 닭꼬치 사랑해사과C주스
1107,찹쌀밥 링츄러스 오징어무국 알감자버터구이 치즈불닭 무말랭이김치 딸기두유
1108,추가밥 잔치국수 마들렌 파닭 배추김치무침 비피더스명장
1109,찹쌀밥 떡국 카레감자햄볶음 비엔나치즈떡볶음 깍두기 초코두유 소보루빵
1110,기장쌀밥 쇠고기미역국 양념깻잎지 김치닭살볶음 부추잡채 흰색앙금절편
1111,오므라이스밥 지단 얼갈이된장국 꼬치없는떡꼬치 깍두기 용가리치킨 머스터드 비피더스명장포도
1112,찹쌀밥 브라우니초코케이크 맑은콩나물국 새우젓양념 부추양파겨자무침 사각어묵볶음 족발구이 무말랭이김치
1113,차수수밥 생새우살아욱국 시금치무침 푸실리미트볼조림 저염고등어카레구이 배추김치 사과
1114,쇠고기콩나물밥 해물수제비국 통곡물뮤즐리멸치볶음 스모그햄전 닭장각오븐구이 열무김치 양념장
1115,삼겹살김치볶음밥 김가루 블루베리쨈샌드위치 미소미역된장국 달걀후라이 응원리얼소시지바 머스터드 나박김치 플리또
1116,찹쌀밥 로제크림소스스파게티 브로콜리치즈스프 양상추샐러드 오리엔탈D 배추김치 수제오이무피클 뱅글뱅글소시지튀김
1117,흑미밥 대패고추장불고기 쇠고기당면국 부추파절이 레몬쌈무 보쌈김치 연두부찜 양념장
1118,찹쌀밥 우리밀오곡찐빵 부대찌개 콩나물부추무침 고구마치즈롤가스 깍두기 엔요
1119,차조쌀밥 육개장 어묵김치볶음 오리훈제채소볶음 석박지 치즈토마토 발사믹드레싱
1120,클로렐라쌀밥 차승원표닭곰탕 당면사리 숙주나물무침 감자채볶음 언양식바싹불고기 석박지 딸기맛포켓팝콘
1121,단호박카레라이스 우리밀찰핫도그 우리밀칼슘아몬드쿠키 바지락살근대된장국 총각김치 워터젤리
1122,혼합팔곡 대패간장불고기 오징어무국 탕평채 무말랭이쪽파무침 바나나
1123,새우살계란볶음밥 청양초콩나물국 토마토소스등갈비구이 배추김치 꼬물이만두 초간장
1124,찹쌀밥 사골우거지된장국 연탄오리불고기 파채 깻잎 햄달걀말이 총각김치 비요뜨
1125,모둠콩밥 김치콩나물국 해물우동볶음 고구마치즈롤가스 열무김치 사과
1126,흑미밥 감자으깬샐러드 건새우무국 양배추찜 오향장육 보쌈김치 고추냉이쌈무 두부우렁쌈장
1127,죽 오징어먹물고구마피자 초코몬드 김치볶음 시리얼 
1128,통밀쌀밥 매콤어묵쑥갓탕 쌈장 녹차고추냉이무쌈 파채콩나물무침 돈오븐구이 보쌈김치 파프리카스틱 오이스틱 고추
1129,하이라이스 인절미토스트 짬뽕국 통살새우까스 열무김치 엔요
1130,오징어덮밥 콩나물 김가루포함 청키초코수프림쿠키 달걀부추국 닭다리살꼬치 깍두기 캐플주스
1131,곤드레콩나물밥 양념간장 미소미역된장국 메밀전병 열무김치 크런키초코스틱 비피더스명장
1132,찹쌀밥 설렁탕 소면 브로콜리 초장 가래떡츄러스 고구마미트번 석박지
1133,찹쌀밥 김자반 어묵우동 팡오쇼콜라 체다크림치즈스틱 케첩 단무지 플리또
1134,단호박카로틴쌀밥 전통순대국 골뱅이무침 소면 새송이버섯들깨볶음 석박지 바나나
1135,삼겹살김치볶음밥김가루 건새우아욱된장국 돈육메추리알장조림 수제고구마튀김 깍두기 조각파인애플
1136,찹쌀밥 대패고추장불고기 쇠고기미역국 시금치무침 에그타르트 포도주스
1137,홍국쌀밥 쫄자장면 돼지갈비김치찌개 임연수구이 깍두기 김구이
1138,찹쌀밥 해물볶음우동 등뼈감자탕 연두부샐러드 석박지 짜먹는요구르트
1139,찹쌀밥 닭살카레떡볶음 쇠고기두부탕국 육즙가득버섯만두찜 배추김치 검은콩현미칩 사과주스
1140,차조쌀밥 검정깨두부 참치김치볶음 오색옹심이미역국 데리야끼멘츠카츠타워버거 무말랭이진미채무침
1141,찹쌀밥 죽 쫄면야채무침 황도샐러드 키위D 통등심돈가스 깍두기
1142,찹쌀밥 우리밀칼슘붕어빵 등뼈우거지국 날치알달걀찜 치킨너겟 머스터드 배추김치 망고맛스무디
1143,혼합십곡밥 소면설렁탕 오징어사과초무침 전유어 초간장 깍두기 감귤
1144,찹쌀밥 떡국 청포묵김가루무침 치즈불닭 깍두기 달콤배
1145,오므라이스 지단포함 팽이버섯미소장국 스트링치즈어묵바 딸기맛도넛 열무김치
1146,카레햄채소볶음밥 얼큰해물어묵우동 석박지 단무지 엔요 또띠아고구마피자
1147,흑미밥 몽슈슈레인보우롤 부대찌개 양념깻잎찜 두부달걀부침 깍두기 도시락김
1148,찹쌀밥 맑은콩나물국 오리훈제 허니머스터드D 레몬무쌈 매콤감자볶음 보쌈김치 블루베리크림치즈찰떡
1149,현미찹쌀밥 떡만두국 숙주맛살무침 비빔막국수 닭갈비 배추김치
1150,스팸김치마요덮밥 바지락순두부백탕 멕시칸샐러드 고구마떡맛탕 나박김치
1151,찹쌀밥 김치수제비국 자장떡볶이 총각김치 통살새우까스 망고주스 메이플피칸파이
1152,찰보리밥 닭개장 순대채소볶음 햄달걀말이 깍두기 사과
1153,찹쌀밥 자장면한그릇 달걀파국 탕수육 배추김치 단무지 바나나
1154,찹쌀밥 감자짜글이찌개 숙주맛살무침 치즈불닭 배추김치 머스캣음료 부드러운와플
1155,흑미밥 열무해물된장국 돈육버섯고추장불고기 고구마땅콩맛탕 총각김치 감귤
1156,흑미밥 꽃게찌개 매운돼지갈비찜 파프리카잡채 배추김치 사과
1157,찹쌀밥 수제초코파이 오징어무국 돈육데리야끼구이 스트링치즈산적 바나나두유
1158,찰옥수수밥 부대찌개 김치단무지어묵잡채 가자미살빵가루튀김 열무김치 골드파인애플
1159,찹쌀밥 간장 참기름 우동한그릇 순대 떡볶이 햄스크램블드에그 배추김치 단무지
1160,훈제오리새우볶음밥 미니크루아상 얼큰콩나물국 새우튀김 석박지 감귤주스
1161,완두콩밥 달걀부추국 새송이버섯들깨볶음 파닭 깍두기 자장덮밥소스 엔요
1162,흑미밥 맑은콩나물국 쌈장 오향장육 레몬무쌈 부추양파겨자무침 보쌈김치 배 파프리카스틱 오이스틱 고추
1163,강황쌀밥 한방한우갈비탕 저염고등어무조림 달걀찜 배추김치 골드키위
1164,흑미밥 동태쑥갓탕 숙주맛살무침 양상추샐러드 발사믹D 치즈불닭 깍두기 배
1165,찹쌀밥 떡국 돈등심찹스테이크 스테이크S 비름나물고추장무침 애호박느타리버섯볶음 석박지 감귤
1166,김밥 얼큰해물어묵우동 우리밀찰핫도그 배추김치 단감
1167,찹쌀밥 김치콩나물국 잔멸치볶음 햄달걀말이 깍두기 김구이
1168,단호박카로틴쌀밥 누룽지 한방한우갈비탕 당면 쌈장 파채콩나물무침 눈꽃치즈샐러드 키위D 애호박전 해물김치전 통삼겹구이 임연수구이 보쌈김치 메이플피칸파이 유자차 컵과일
1169,찹쌀밥 맑은미역국 콩나물부추무침 새송이버섯들깨볶음 배추김치 통살새우까스 청포도
1170,찹쌀밥 떡국 몬테크리스토샌드위치 새송이버섯들깨볶음 수제언양식숯불고기 열무김치 김구이
1171,기장쌀밥 고구마파이 소고기청국장찌개 매콤돼지갈비떡찜 부추잡채 배추김치
1172,찹쌀밥 청양초콩나물국 멸치견과류볶음 김치볶음김가루 계란후라이 군고구마 스팸구이 백김치 아침에주스
1173,찹쌀밥 닭곰탕 달걀두부구이 양념장 어묵김치볶음 동치미 소보루빵 알알이청포도주스
1174,혼합십곡밥 유부쫄면무침 참치김치찌개 고구마치즈롤가스 깍두기 치즈토마토 발사믹드레싱
1175,찹쌀밥 순대돼지고기국 오이도라지무침 순살가자미카레튀김 석박지 연두부찜 양념장 짜먹는요구르트
1176,햄채소볶음밥 짬뽕국 스트링치즈어묵바 깍두기 자장덮밥소스 망고주스 청포도
1177,삼색소보로덮밥 우동국물 닭다리살꼬치 동치미 감귤주스 흰색앙금절편
1178,흑미밥 새알만두국 파프리카잡채 순살닭갈비 깍두기 쁘띠첼
1179,찹쌀밥 김치콩나물국 새우젓양념 멸치고추장볶음 족발구이 배추김치 크런키초코스틱
1180,찰보리밥 몽글순두부들깨탕 햄달걀말이 임연수구이 깍두기 방울토마토
1181,죽 크링클컷 케첩 튼튼햄버거 깍두기 무지개떡 바나나맛우유
1182,찹쌀밥 매콤어묵쑥갓탕 시금치무침 한우불고기 배추김치 감귤
