,요리명
488,죽 삶은계란 콘푸레이크 스페셜K 아침에샌드위치
489,콩나물밥 두부된장찌개 핫도그케첩 과일쥬스
490,찹쌀밥 코코번 쇠고기미역국 계란장조림 스팸구이 케첩 배추김치 오렌지쥬스
491,흑미밥 꽈리고추어묵볶음 치즈돈까스 배추김치 수박 옥수수스프마늘빵 
492,죽 진미채야채무침 오꼬노미야끼 석박지 모닝빵 딸기쨈 상큼한수제레몬에이드
493,찹쌀밥 참치김치볶음 건새우아욱된장국 언양식바싹불고기 조미김 고칼슘지방제로 플레인요구르트 몬테디저트
494,찹쌀밥 등뼈우거지국 마늘쫑잔멸치볶음 그릴치킨스테이크 열무김치 과일음료
495,흑미밥 설렁탕 당면사리 사태떡찜 아삭이고추된장무침 석박지 키위
496,찹쌀밥 우리쌀돼지바나나링카스테라 조랭이떡만두국 진미채엿장조림 오색현미육원전 허니버터아몬드 사과
497,잔치국수 밥 아이스슈 단무지쪽파무침 깐풍기 배추김치 포도스무디
498,차수수밥 순두부찌개 부추파절이 상추쌈 쌈장 갈비양념목살구이 보쌈김치 블루베리
499,찹쌀밥 북어채달걀국 멸치풋고추조림 야채소시지 케첩 배추김치 콘푸레이크 오레오오즈 우유만쥬
500,찹쌀밥 카카오롤케이크 닭다리삼계탕 오징어김치전 부추겉절이 석박지 바나나
501,날치알김치볶음밥 피자핫도그 쇠고기무국 계란찜 열무김치
502,찹쌀밥 딸기잼핫케이크 떡국 진미채엿장조림 등갈비조림 배추김치 오렌지쥬스
503,짬뽕밥 당면 양파춘장 고감콘크로켓케첩 배추김치 단무지 아이스홍시
504,쇠고기콩나물밥 시래기된장국 토마토큐브치즈샐러드 양념치킨 배추김치
505,찹쌀밥 아욱된장국 느타리버섯맛살볶음 너비아니조림 배추김치 콘푸레이크 그래놀라 리얼수제딸기머핀
506,전주식비빔밥 언양식떡갈비 무채맑은국 배추김치 바람떡 수박
507,강황쌀밥 쇠고기미역국 양배추쌈 쌈장 한돈고추장볶음 두부구이 깍두기 멜론
508,찹쌀밥 북어채무국 고구마닭갈비 부들어묵조림 깍두기 플라워파이 골드키위요플레
509,클로렐라밥 호박두부된장국 상추쌈 아삭이고추 베이컨감자채볶음 대패불고기 배추김치 포도
510,찹쌀밥 쇠고기육개장 통등심돈까스 마카로니콘치즈구이 배추김치 사과
511,찹쌀밥 다시마무국 씨앗미트볼조림 무말랭이무침 배추김치 콘푸레이크 초코첵스 프렌치토스트
512,자장면 계란파국 후라이드치킨 배추김치 레몬에이드
513,오므라이스 우동국물 케이준치킨샐러드 허브가들어간소시지 배추김치 바나나
514,찹쌀밥 팽이버섯된장국 쥐포채볶음 치킨데리야끼조림 배추김치 딸기요플레 우리밀와플 생크림
515,찰보리밥 설렁탕소면사리 비엔나메추리알조림 사과무생채 석박지 수박
516,잡채밥 유부된장국 무장아찌 배추김치 짜장소스 요구르트 모짜렐라 소시지핫도그
517,계란밥 팡오쇼콜라 꽃게된장국 비엔나메추리알조림 맛김 배추김치 과일쥬스
518,사과카레라이스 얼큰어묵국 단무지쪽파무침 롱롱치즈스틱 배추김치 카프리썬
519,찹쌀밥 참치김치찌개 진미채엿장조림 스팸구이케첩 깍두기 애플파이 과일쥬스
520,잡곡밥 쇠고기미역국 매운갈비찜 참나물무침 부추잡채 조각케이크
521,비빔밥 볶음고추장 근대된장국 미트볼조림 스크램블에그 배추김치 사과푸딩
522,밥 김치볶음 소시지구이 김가 팽이버섯된장국 닭꼬치 배추김치 오레오케이크 썬업
523,현미밥 열무된장무침 과일샐러드 돈카츠 배추김치 요구르트 크림스프마늘빵 
524,찹쌀밥 소면설렁탕 브로콜리초장 치즈불닭 석박지 무쌈
525,계란밥 등뼈우거지국 야채핫바머스타드 쵸코우유 우유크림빵
526,흑미밥 참치김치찌개 영양계란찜 망고그린샐러드 새우홍게살만두우동사리 배추김치 방울토마토
527,찹쌀밥 우렁된장찌개 오향장육 비빔막국수 보쌈김치 스트로베리라떼
528,찹쌀밥 황도샐러드드레싱 햄카츠 배추김치 얼려먹는요쿠르트 도라에몽암기빵 크림스프
529,김가루추가밥 니가가락국수 떡볶이 수제야채튀김 배추겉절이 오렌지쥬스
530,찹쌀밥 떡국 고구마맛탕 닭봉윙오븐구이 석박지 조각파인애플
531,찹쌀밥 죽 웨지감자 깍두기 과일쥬스 치즈피자브리또 바나나
532,차조밥 들깨수제비 새콤달콤무쌈어린잎 돈오븐구이 배추김치 자두 
533,카레라이스 들깨무채국 양념닭강정 깍두기 카프리제토마토샐러드 약과
534,찹쌀밥 쇠고기무국 진미마요네즈조림 계란떡볶이 모듬견과 썬업 마카롱 
535,잡곡밥 등뼈우거지국 연두부찜양념장 불닭바베큐롤까스 배추김치 파인애플
536,보리밥 순두부국 등갈비김치조림 햄야채계란말이 깍두기 생크림과일샐러드
537,찹쌀밥 오이피클 감자건포도샐러드 치킨커틀릿 떠먹는한끼오뜨파인애플 우리사과팬케이크 크림스프
538,찰보리밥 우렁살아욱된장국 동파육 무채장아찌 상추쌈 아삭이고추 배추김치 색방울토마토
539,삼색소보로덮밥 청양초콩나물국 미역줄기볶음 깍두기 오렌지주스 닭꼬치
540,김가루찹쌀밥 초코칩 트위스트 등갈비조림 배추김치 데르뜨젤리백도 모듬견과
541,저염팽이맑은국 흑임자연근샐러드 고구마떡맛탕☆ 지바치밥 배추김치 포도
542,흑미밥 돈육김치찌개 깻잎쌈 쌈장 양파장아찌 한돈맥적구이 보쌈김치 요플레
543,찹쌀밥 곰탕한그릇 참치야채볶음 야채소시지케첩 깍두기 단지쵸코우유 아침도넛
544,흑미밥 얼갈이배추된장국 새송이 통마늘구이 떡갈비 배추김치 바나나
545,자장덮밥 계란파국 무장아찌 소고기한섬왕만두 배추김치 청포도후레쉬
546,죽 콘푸레이크 오레오오즈 곡물바 길거리토스트 
547,자장밥 오징어짬뽕국 레몬크림깐쇼새우 배추김치 수제과일음료
548,찹쌀밥 얼큰콩나물국 속보이는쫄깃만두 햄야채계란말이 배추김치 과일쥬스 초코티라미수조각케잌
549,잡곡밥 건새우아욱된장국 비빔막국수계란 고구마닭갈비 나박김치 멜론
550,차조밥 등뼈감자탕 크리미어니언수제치킨 고등어구이 석박지 구슬아이스크림
551,찹쌀밥 설렁탕 건새우고추장볶음 향긋한깻잎주먹완자케첩 깍두기 모닝퐁라떼 크림빵
552,찰보리밥 부대찌개 양배추쌈 케일쌈 젓갈 충무식오징어 어묵무침 햄야채계란말이 석박지 김구이 셀프김밥
553,새우살볶음밥 콩비지찌개 돈육메추리알장조림 콩나물무침 깍두기 곡크림치즈롤
554,대패불고기야채덮밥 팽이미소된장국 배추김치 견과 쵸코우유 마카다미아넛쿠키
555,참치야채비빔밥 유부장국 배추김치 회오리요술감자시즈닝 과일쥬스
556,흑미밥 부대찌개 발사믹샐러드 고메치즈함박스테이크 깍두기 사과
557,찹쌀밥 쇠고기무국 계란떡볶이 롱롱치즈스틱 모듬견과 썬업 초코파이
558,현미밥 들깨감자수제비 연탄오리불고기파채 양파깻잎간장장아찌 새콤달콤무쌈어린잎 배추김치 파인애플
559,찹쌀밥 쇠고기미역국 안동찜닭 청포묵김가루무침 석박지 딸기맛포켓팝콘
560,찹쌀밥 뮤즐리잔멸치볶음 콘푸레이크 스페셜K 누룽지 아침에샌드위치
561,추가흑미밥 죽 잔멸치조림고추볶음 깍두기 바나나 파프리카 아삭고추땅콩쌈장
562,찹쌀밥 닭곰탕 치커리사과무침 김치피자탕수육 석박지 바나나
563,계란밥 팡오쇼콜라 꽃게된장국 비엔나메추리알조림 맛김 배추김치 과일쥬스
564,고구마밥 차돌박이된장찌개 검은깨두부조림 안동찜닭넙적당면 배추김치
565,흑미밥 맑은콩나물국 파절이 상추쌈 쌈장 돼지고기구이 새송이 통마늘구이 보쌈김치 아이스망고
566,찹쌀밥 닭곰탕 새우까스배추김치 단지 바나나우유 초코에끌레어
567,차조밥 도토리묵채국 영양계란찜 상추쌈아삭고추 파채콩나물무침 샤브불고기
568,닭갈비비빔밥 콩가루배추국 고구마맛탕 배추김치 단무지무침 짜먹는요구르트
569,찹쌀밥 딸기잼핫케이크 설렁탕 오리훈제 부추무침 무산김 석박지 사과한가득쥬스 카카오아몬드
570,흑미밥 참치김치찌개 황도샐러드드레싱 쫄뱅이 모듬캠핑구이 깍두기 바나나
571,자율밥김자반 잔치국수 보쌈김치 귤 용가리치킨 머스터드 이온음료
572,새우볶음밥 쇠고기우거지국 배추김치 허니버터아몬드 콘푸레이크 오레오오즈 초코파이
573,찰보리밥 우렁살배추국 오리불고기파채 배추김치 자몽에이드 마카로니콘치즈구이
574,찹쌀밥 떡국 청포묵김가루무침 오징어김치전 석박지 깻잎김치 딸기우유
575,죽 깻잎찜 어묵메추리알장조림 딸기요플레 팥빵
576,쇠고기미역국라면 삼색나물무침 왕새우튀김 배추김치 제주감귤쥬스 생일케이크
577,삼겹살김치볶음밥 우렁된장찌개 통곡물뮤즐리멸치볶음 햄야채계란말이 열무김치 달콤배
578,찹쌀밥 북어콩나물국 쥐취포조림 야채소시지케첩 배추김치 콘푸레이크 초코첵스 우리밀와플 생크림
579,흑미밥 들깨무채국 아몬드실치볶음 닭강정얌운센 배추김치
580,찹쌀밥 죽 골뱅이채소무침 소면 통등심돈까스 배추김치 바삭김부각
581,찹쌀밥 떡국 진미채엿장조림 등갈비조림 배추김치 오렌지쥬스 허니버터바게트볼
582,차조밥 설렁탕소면 브로콜리초장 찹쌀순대허브소금 석박지
583,하이라이스 치커리사과무침 닭장각오븐구이 깍두기 두부김치국 식혜
584,계란밥 순두부찌개 비고왕교자만두 배추김치 오렌지쥬스 브라우니케잌
585,갖은나물비빔밥언양식떡갈비 꼬치어묵국 계란지단 배추김치 레몬에이드 송편
586,찹쌀밥 참치김치찌개 잔멸치아몬드조림 스팸구이케첩 깍두기 애플파이 과일쥬스
587,찰보리밥 제철꽃게탕 흑임자연근샐러드 콩나물잡채 김피탕 깍두기
588,찹쌀밥 팽이된장찌개 쫄면야채무침 매쉬드포테이토함박 배추김치 조각파인애플
589,찹쌀밥 들깨감자수제비 등갈비조림 배추김치 쁘띠푸딩 아침 쿠키
590,잡곡밥 열무된장국 맛감자볼케첩 닭반마리전기구이 배추김치 치킨오이무피클
591,흑미밥 쇠고기미역국 발사믹샐러드 한돈양념구이 무쌈 보쌈김치 제철토마토생과일주스
592,찹쌀밥 초코칩 트위스트 닭곰탕 햄감자채볶음 맛살계란말이 배추김치 딸기바나나쥬스
593,콩나물버섯영양밥양념간장 들깨무채국 맥시칸타코 배추김치 과일쥬스
594,찹쌀밥 설렁탕 면사리 연두부찜 순대야채볶음 석박지 포도푸딩
595,추가밥 죽 돈육김치볶음 두부 레몬에이드 오징어먹물고르곤졸라피자
596,흑미밥 북어맑은국 영양계란찜 오향장육 무말랭이무침 상추쌈 아삭고추 보쌈김치
597,찹쌀밥 스파게티 우동국물 오색피클 언양식바싹불고기 배추김치 마늘빵
598,찹쌀밥 쇠고기육개장 쵸코우유 쿠키 길거리토스트
599,갈비치킨바베큐소스덮밥 팽이미소국 양배추쌈쌈장 고구마떡맛탕☆ 배추김치 바나나
600,흑미밥 맑은아귀탕 제육볶음 마카로니콘치즈구이 보쌈김치 떠먹는아이스홍시
601,찹쌀밥 초코칩 트위스트 쇠고기무국 건새우고추장볶음 옛날소세지전 텐저린
602,찰보리밥 우렁살아욱된장국 무채장아찌 상추쌈 아삭이고추 돈오븐구이 배추김치 색방울토마토
603,클로렐라쌀밥 부대찌개 어묵당면잡채 순살가자미튀김 깍두기 도시락김
604,찹쌀밥 쇠고기육개장 깻잎양념찜 랍스터커틀릿 얼려먹는요쿠르트 도라에몽암기빵
605,추가흑미밥 닭장각삼계탕 잔멸치조림고추볶음 고소참치야채전 깍두기 바나나 파프리카 아삭고추땅콩쌈장
606,흑미밥 순두부백탕 한돈수육 미나리무생채 상추 깻잎 아삭이고추 쌈장 비빔막국수 보쌈김치
607,찹쌀밥 두부김치국 파채겉절이 언양식바싹불고기 우리밀빵 총각김치 콘푸레이크 그래놀라
608,쇠고기야채하이라이스 수제 피자토스트 계란파국 배추김치 꿀설기떡 과일음료
609,찹쌀밥 고추장짬뽕국 충무식오징어초무침 양파장아찌 탕수육 배추김치 요거타임
610,추가밥 죽 감자사라다샌드위치 허니버터아몬드 쵸코우유
611,찰보리밥 떡국 알감자조림 양배추쌈케일쌈 쌈장 양파깻잎간장장아찌 대패불고기 배추김치
612,찹쌀밥 등뼈감자탕 찐옥수수 콩나물무침 어니언새우까스 양파링 석박지
613,찹쌀밥 웰빙찰보리빵 아욱된장국 등갈비김치찜 건새우볶음 배추김치 아침에포도쥬스
614,현미밥 시금치토장국 두부샐러드참깨드레싱 순살고구마닭갈비 클링클럿감자튀김 배추김치 바나나
615,사과카레라이스 초코칩 트위스트 맑은우동국 찐만두양념장 배추김치 데르뜨젤리백도
616,율무밥 민물새우수제비국 잔멸치땅콩조림 수제떡갈비 방울토마토 파프리카샐러드 드레싱 깻잎쌈쌈장
617,쇠고기콩나물밥 떡국 도라지오이생채 김치치즈함박스테이크 깍두기 달콤배
618,찹쌀밥 팽이버섯된장국 쥐포채볶음 치킨데리야끼조림 배추김치 딸기요플레 우리밀와플 생크림
619,팥밥 들깨미역국 고구마줄기볶음 부추잡채 수제파닭 배추김치 조각케이크
620,하이라이스 순두부찌개 돼지고기구이 치커리사과무침 깍두기 모닝빵 딸기쨈
621,찹쌀밥 초코칩 트위스트 설렁탕 언양식바싹불고기 석박지 바나나우유
622,순대국밥 부추겉절이 석박지 바나나 핫도그
623,찹쌀밥 옥수수스프 쫄면야채무침 통등심돈까스 깍두기 조각파인애플
624,찹쌀밥 조랭이떡만두국 진미채엿장조림 오색현미육원전 우리밀허니카스테라 사과
625,자장밥 계란파국 김말이강정 배추김치 요구르트
626,찹쌀밥 들깨수제비국 매운돼지갈비찜 양파장아찌 마카로니콘치즈구이 열무김치
627,찹쌀밥 참치김치찌개 파래돌김자반 스팸구이 후라이 카카오머핀 오렌지 스무디
628,흑미밥 아욱감자된장국 수육보쌈 무말랭이무침 비빔막국수 상추쌈 아삭이고추 배추김치
629,찹쌀밥 도토리묵국 찹스테이크감자조림 계란찜 배추김치 칼슘붕어빵
630,찹쌀밥 나주곰탕당면 온두부김치볶음 텐저린 에그타르트
631,기장밥 닭곰탕 잔멸치조림고추볶음 고소참치야채전 깍두기 바나나
632,오므라이스 미소된장국 크링클컷 케첩 허브가들어간소시지 배추김치 마시는샐러드주스
633,사과카레라이스 계란파국 맛김 핫도그케첩 곡물바 폴리또쥬스
634,잡채밥 자장소스 호박된장국 고구마맛탕 배추김치 레몬에이드
635,찹쌀밥 맑은콩나물국 멸치견과류볶음 김치볶음김가루 계란후라이 스팸구이 돌파라다이스
636,찹쌀밥 딸기잼핫케이크 떡국 오리훈제야채무침 배추김치 내사랑사과쥬스 맛김
637,김자반찹쌀밥 유부쫄면 만두탕수 배추김치 과일음료
638,찹쌀밥 쇠고기육개장 두부양념구이 양념닭강정 석박지 달콤배
639,새우볶음밥 쇠고기우거지국 계란후라이 배추김치 바나나우유 초코파이
640,흑미밥 북어맑은국 오향장육 무말랭이무침 상추쌈 아삭고추 배추김치
641,김밥볶음밥 도시락김 우동국물 떡볶이 배추김치 단무지무침 닭꼬치
642,김자반찹쌀밥 쇠고기무국 어묵메추리알장조림 쵸코우유 프렌치토스트
643,제육덮밥 유부장국 야채튀김 배추김치 바나나
644,흑미밥 돈육김치찌개 부추양파무침 오리훈제구이 머스터드 깍두기 무쌈 사과
645,김가루찹쌀밥 초코칩 트위스트 얼큰콩나물국 등갈비조림 배추김치 데르뜨젤리백도 모듬견과
646,기장밥 들깨감자수제비 두부구이양념장 안동찜닭넙적당면 배추김치
647,흑미밥 쇠고기버섯찌개 꽃맛살샐러드 순살닭갈비 석박지 조각파인애플
648,찹쌀밥 죽 뮤즐리잔멸치볶음 쵸코우유 아침에샌드위치
649,김가루밥 오븐치즈스파게티한그릇 명핫도그케첩 치즈 머스타드 수제오이무피클 크림스프
650,유부초밥 자율밥 콩나물국 알감자버터구이 고구마크림치즈롤카츠 배추김치
651,찹쌀밥 초코칩 트위스트 닭곰탕 햄감자채볶음 맛살계란말이 배추김치 딸기바나나쥬스
652,콩나물버섯영양밥양념간장 들깨무채국 수제 또띠아 치킨랩 배추김치 과일쥬스
653,흑미밥 쑥갓어묵국 사태떡찜 파프리카잡채 배추김치 내사랑사과쥬스
654,김치볶음밥 무채맑은국 계란후라이 야채핫바머스타드 포도쥬스 우유크림빵
655,찰보리밥 부대찌개 라면사리 납작군만두 비빔야채 햄야채계란말이 깍두기
656,찹쌀밥 순대돼지고기국 아삭이고추된장무침 오징어김치전 순살가자미튀김 석박지
657,죽 깍두기 과일쥬스 치즈피자브리또 바나나
658,흑미밥 팽이버섯된장국 상추쌈 아삭이고추 대패불고기 새송이 통마늘구이 배추김치
659,찹쌀밥 참치김치볶음 맑은어묵탕 스팸구이케첩 아침REAL쥬스 모카소보로빵생크림
660,기장밥 순두부백탕 상추쌈 아삭이고추 양파깻잎간장장아찌 돈오븐구이 배추김치 사과
661,흑미밥 떡국 발사믹샐러드 고메치즈함박스테이크 깍두기 사과
662,단호박카레라이스 팽이미소된장국 야채핫바머스타드 배추김치 비타 초코파이
663,차조밥 설렁탕소면 브로콜리초장 찹쌀순대허브소금 저염고등어구이 석박지
664,찹쌀밥 고추장짬뽕국 연두부찜 오이지무침 탕수육 배추김치
665,찹쌀밥 조랭이떡만두국 통등심돈까스케첩 배추김치 페스츄리꽈배기 오렌지쥬스
666,참치마요덮밥 꼬치어묵국 떡볶이 수제야채튀김 배추김치 요쿠르트
667,찹쌀밥 쇠고기미역국 단호박견과류찜 치즈불닭 배추김치 바나나
668,대패불고기야채덮밥 팽이미소된장국 배추김치 쵸코우유 마카다미아넛쿠키
669,찰보리밥 들깨무채국 뮤즐리지리볶음 양배추쌈쌈장 수제떡갈비 배추김치
670,찹쌀밥 녹두닭곰탕 찹쌀콩멸치볶음 고구마 크림치즈미트번 김치소 깍두기 오렌지
671,죽 콘푸레이크 오레오오즈 곡물바 길거리토스트 
672,김가루밥 잔치국수 고구마떡맛탕☆ 배추겉절이 바나나
673,찹쌀밥 등뼈감자탕 골뱅이야채무침 햄야채계란말이 석박지 아이스망고
674,찹쌀밥 아욱된장국 느타리버섯맛살볶음 너비아니조림 배추김치 포도쥬스 리얼수제딸기머핀
675,잡곡밥 얼큰콩나물국 연두부찜양념장 치즈돈까스 배추김치 파인애플
676,치킨마요덮밥 유부된장국 브로콜리 초장 배추김치 보트감자 짜먹는요구르트
677,찹쌀밥 고구마빅데니쉬 배추된장국 참치야채볶음 스팸구이 케첩 깍두기 아침에쥬스
678,흑미밥 우렁살아욱된장국 상추쌈 아삭이고추 햄감자채볶음 대패불고기 배추김치
679,찹쌀밥 해물볶음우동 햄부대찌개 청포묵김가루무침 배추김치 딸기우유
680,찹쌀밥 떡국 제육구이 감귤쥬스 맛김 에그타르트 김치
681,참치야채비빔밥 수제피자토스트 얼큰어묵국 배추김치 과일음료
682,콩나물밥 양념장 호박고추장찌개 생김구이 소떡소떡꼬치 깍두기 카프리제토마토샐러드
683,계란밥 팡오쇼콜라 쇠고기무국 비엔나메추리알조림 배추김치 과일쥬스
684,잡곡밥 민물새우수제비국 잔멸치땅콩조림 닭장각오븐구이 배추김치 치킨오이무피클
685,자장덮밥 인절미토스트 계란파국 배추김치 요구르트 꼬물이만두 초간장
686,찹쌀밥 참치김치찌개 계란후라이 스팸구이케첩 깍두기 애플파이 과일쥬스
687,중화풍잡채덮밥 호호불며먹는호빵 얼큰콩나물국 탕수육 배추김치 요구르트
688,찹쌀밥 설렁탕 면사리 두부구이돈양념 오징어김치전 석박지 조각파인애플
689,찹쌀밥 허니 버터브래드 물만두국 두부 돈육김치볶음 깍두기 사과쥬스
690,율무밥 떡국 안동찜닭 알감자버터구이 배추김치 사과
691,찹쌀밥 어묵우동국 청포묵김가루무침 통등심돈까스 배추김치 생크림과일샐러드
692,김치볶음밥 두부된장국 비엔나떡볶음 오이생채 스크램블드에그 오렌지쥬스 하트파이
693,찹쌀밥 황도샐러드드레싱 해쉬브라운 수제함박배추김치 마늘빵 단호박크림스프
694,닭갈비덮밥 다시마무국 계란찜 고구마떡맛탕 깍두기 요구르트
695,김자반찹쌀밥 얼큰콩나물국 연탄오리불고기파채 배추김치 딸기쥬스 프렌치토스트
696,추가밥 자장면한그릇 달걀송송파국 단무지쪽파무침 군만두 배추김치 방울토마토
697,해물볶음밥 연두부찜 양념장 타워데리멘츠카츠 깍두기 두부김치국
698,찰보리밥 떡국 부추잡채 스팸구이케첩 배추김치 부드러운 핫케이크 쵸코우유
699,순대국밥 야채매콤달콤떡볶이 바삭김말이 부추겉절이 석박지 과일쥬스
700,찹쌀밥 피자핫도그 녹두닭곰탕 양파장아찌 석박지 도시락김
701,카레라이스 얼큰어묵국 야채핫바머스타드 배추김치 마카다미아쿠키 과일음료 
702,찹쌀밥 햄부대찌개 사과무생채 고추잡채 꽃빵 제철호박전 깍두기
703,찹쌀밥 고추장짬뽕국 콩나물무침 크리미어니언수제치킨 배추김치 바나나
704,찹쌀밥 바지락수제비국 딸기잼핫케이크 미트볼떡조림 도토리묵김치무침 콘푸레이크 초코첵스
705,대패불고기야채덮밥콩나물 맑은우동국 상추쌈 아삭이고추 수제고구마튀김 배추김치 빼빼로 사과
706,흑미밥 등뼈감자탕 부추양파무침 오리훈제구이 머스터드 깍두기 무쌈
707,찹쌀밥 쇠고기무국 등갈비김치찜 깍두기 포도쥬스 똑똑시리얼바 프렌치토스트
708,곡쌀밥 두부된장찌개 캐슈넛멸치볶음 오징어김치전 닭장각오븐구이 석박지 찹쌀모찌 사과
709,찹쌀밥 순두부찌개 파절이 상추쌈 아삭이고추된장무침 감자채볶음 돼지고기구이 보쌈김치
710,찹쌀밥 설렁탕 돈육메추리알조림 파래돌김자반 배추김치 똑똑피칸파이 호두 아몬드두유
711,참치김치덮밥 수제토스트피자 저염팽이맑은국 배추김치 과일음료
712,찹쌀밥 초코칩 트위스트 쇠고기무국 잔멸치땅콩조림 햄야채계란말이 배추김치 귤 맛김 누룽지
713,흑미밥 바베큐갈비치킨 갈비탕 갈비탕 황도샐러드드레싱 애호박전 부추전 석박지 보쌈김치 삼색과일 대추차 쿠키
714,죽 콘푸레이크 오레오오즈 곡물바 길거리토스트 
715,김가루밥 잔치국수 바나나 수제인절미토스트 
716,밥 김치볶음 소시지구이 김가 카스테라 계란파국 아몬드멸치볶음 석류사과쥬스
717,기장밥 떡만두국 콩나물무침 감자햄볶음 닭갈비 배추김치 바나나
718,찹쌀밥 초코칩 트위스트 건새우아욱된장국 언양식떡갈비 배추겉절이 오렌지쥬스
719,곡쌀밥 달래두부된장찌개 캐슈넛멸치볶음 김피탕 배추김치 파프리카땅콩쌈장 사과
720,찹쌀밥 얼큰콩나물국 계란장조림 갈비만두양념장 배추김치 우유만쥬 쵸코우유
721,대패불고기야채덮밥콩나물 맑은우동국 양배추쌈 쌈장 배추김치 수제인절미토스트 과일쥬스
722,찹쌀밥 바지락수제비국 브라우니초코케이크 비엔나떡케찹조림 깻잎양념찜 배추김치 오렌지쥬스
723,흑미밥 부대찌개 라면사리 두부양념조림 석박지 사과
724,오징어덮밥 초당황태순두부찌개 깍두기 비요뜨 핫도그케첩 골드파인애플
725,짬뽕밥 당면 브로콜리초장 단무지쪽파무침 타코야끼 배추김치
726,찹쌀밥 고구마 파이 북어콩나물국 계란후라이 스팸구이 케첩 배추김치 맛김 오렌지쥬스
727,팥밥 버터롤케이크 쇠고기미역국 영양갈비찜 삼색나물 부추잡채 배추김치
728,찹쌀밥 설렁탕 돈육김치볶음 두부 깍두기 밤만주 쵸코우유
729,클로렐라밥 황도샐러드드레싱 통등심돈까스 배추김치 옥수수스프
730,찹쌀밥 카스테라 떡국 콩나물무침 메밀김치전병동그랑땡 배추김치 바나나우유
731,봄나물비빔밥 꿀떡
732,찹쌀밥 호박두부된장국 돼지불고기 맛살계란말이 배추김치 능금쥬스 몬테디저트
