,요리명
733,흑미밥 근대감자된장국 양파깻잎간장장아찌 새송이 통마늘구이 돈오븐구이 배추김치 사과
734,찹쌀밥 떡국 건새우호박볶음 야채소시지 배추김치 팔미어파이 비요뜨
735,차조밥 등뼈우거지국 충무식오징어 어묵무침 햄감자채볶음 배추김치 바나나
736,계란밥 붕어빵 쇠고기무국 어묵메추리알조림 배추김치 과일쥬스
737,찰보리밥 참치김치찌개 오이스틱 당근스틱 비빔막국수 육쌈 백김치
738,찹쌀밥 건새우아욱된장국 수제언양식떡갈비 배추겉절이 오렌지쥬스 식빵토스트쨈
739,흑미밥 얼큰콩나물국 안동찜닭 양배추쌈 쌈장 깍두기 방울토마토
740,찹쌀밥 찐빵 시금치된장국 쥐취포조림 갈비만두양념장 배추김치 쵸코우유
741,찹쌀밥 바지락쑥국 참나물유자샐러드 고구마맛탕 지바치밥 배추김치 바나나
742,찹쌀밥 바지락수제비국 비엔나떡케찹조림 깻잎양념찜 배추김치 오렌지쥬스 피칸파이
743,강황쌀밥 호박두부된장국 샤브고추장불고기 상추쌈 감자전 배추김치 파프리카 아삭고추 땅콩쌈장
744,찹쌀밥 황태순두부찌개 오리훈제단호박볶음 배추김치 맛김 바나나 애플파이
745,자장밥 오징어짬뽕국 돌나물무침 배추김치 과일음료
746,찰보리밥 머핀 건새우아욱된장국 돈육메추리알조림 오이맛살초무침 배추김치 바나나우유
747,찰보리밥 콩나물국 수육보쌈 알배추쌈장 비빔막국수 무말랭이무침
748,찹쌀밥 쇠고기무국 베이컨감자채볶음 한입돈까스케첩 배추김치 우유 식빵토스트쨈
749,기장밥 얼갈이배추된장국 브로콜리 초장 고구마닭갈비 새송이 통마늘구이 배추김치 바나나
750,찹쌀밥 감자다시마국 잔멸치땅콩조림 미트볼두부강정 배추김치 아침에쥬스 모닝빵 딸기잼
751,콩나물밥양념장 한그릇떡만두국 소떡소떡꼬치 배추김치 과일쥬스
752,김자반찹쌀밥 맑은우동국 계란찜 어묵매콤볶음 녹차호떡 배추김치 딸기바나나쥬스
753,흑미밥 설렁탕소면 찰순대허브소금 저염고등어구이 석박지 방울토마토
754,찹쌀밥 브라우니초코케이크 팽이버섯된장국 파채겉절이 돼지불고기 배추김치 바나나우유
755,참치야채비빔밥초고추장 맑은우동국 수제야채튀김 배추김치 사과
756,찹쌀밥 카스테라 닭곰탕 두부양념조림 맛살미역줄기볶음 배추김치 요쿠르트
757,흑미밥 들깨무채국 연두부찜양념장 돼지불고기 깍두기 파인애플
758,오므라이스 맑은우동국 야채핫바머스타드 배추김치 내사랑사과쥬스
759,찰보리밥 민물새우수제비국 알배추쌈장 새송이 통마늘구이 떡갈비 배추김치
760,흑미밥 동태쑥갓탕 푸실리미트볼조림 새우맛연근 단호박튀김 깍두기 수박
761,강황쌀밥 닭다리삼계탕 아삭이고추쌈장무침 오징어김치전 석박지 참외
762,찹쌀밥 건새우아욱감자된장국 황도샐러드 키위드레싱 수제언양식떡갈비 깍두기 초코칩트위스트 오렌지주스
763,찹쌀밥 부대찌개 두부양념조림 저염고등어카레구이 배추겉절이 블랙사파이어
764,찹쌀밥 밤만주 얼큰콩나물국 돈육달걀장조림 스트링치즈어묵바 배추김치 초코우유
765,잔치국수 녹두밥 쌀초코케익 소떡소떡꼬치 배추겉절이
766,찹쌀밥 브라우니초코케이크 바지락수제비국 비엔나떡케첩조림 된장깻잎찜 배추김치 플리또
767,오징어덮밥 초당황태순두부찌개 백김치 비요뜨 메이플크림치즈파이
768,흑미밥 짬뽕국물 숙주미나리무침 닭갈비 열무김치 바나나
769,흑미밥 시금치된장국 모듬쌈채 우렁두부쌈장 파채콩나물무침 삼겹살 배추김치
770,찹쌀밥 유부김치콩나물국 아몬호두파래돌김자반 달걀후라이 스팸구이 케첩 깍두기 생크림오믈렛 딸기바나나라떼
771,찹쌀밥 떡국 찰보리앙버터 돈육김치볶음 온두부 깍두기 플리또
772,흑미밥 참치김치찌개 우거지나물무침 돈육버섯불고기 모짜치즈달걀말이 무말랭이김치 수박
773,찹쌀밥 비스킷슈 시금치된장국 돼지불고기 맛살달걀말이 열무김치 상큼한사과주스
774,김밥멸치주먹밥 꼬지어묵우동 쌀초코케익 배추겉절이 블랙사파이어
775,찹쌀밥 우리밀허니카스테라 김치가마보꼬어묵국 참치채소볶음 김치메밀전병 동그랑땡 깍두기 딸기우유
776,찹쌀밥 모카번 감자버섯수제비국 고구마건포도샐러드 채소고기말이 배추김치
777,흑미밥 모카번 양송이크림스프 단무지쪽파무침 망고과일샐러드 통등심돈까스 배추김치
778,흑미밥 미소미역된장국 한방한우갈비찜 상추부추겉절이 곤드레나물잡채 석박지
779,달걀밥 붕어빵 쇠고기두부탕국 비엔나메추리알조림 배추김치 메론두유
780,찹쌀밥 오징어무국 수제언양식떡갈비 배추겉절이 식빵토스트 딸기쨈 포도주스
781,찹쌀밥 우리밀고구마롤케익 들깨무채국 쥐포채볶음 갈비만두 배추김치 바나나두유
782,하이라이스 찹쌀밥 크림빵 단무지쪽파무침 치킨너겟 머스터드 깍두기 플리또
783,찹쌀밥 얼큰콩나물국 오리훈제단호박볶음 김구이 애플파이 골드파인애플
784,찹쌀밥 우리찹쌀초코롤 동태쑥갓탕 미트볼떡조림 스크램블드에그 배추김치 바나나우유
785,찹쌀밥 쇠고기미역국 베이컨감자채볶음 한입돈까스 배추김치 혼합시리얼 흰우유
786,찹쌀밥 감자다시마국 잔멸치땅콩조림 미트볼두부강정 배추김치 모닝빵 딸기잼 플리또
787,김자반찹쌀밥 머핀 팽이버섯미소장국 게맛살달걀찜 어묵매콤볶음 딸기두유
788,찹쌀밥 우리밀고구마롤케익 들깨무채국 쥐포채볶음 갈비만두 배추김치 김구이 바나나두유
789,강황쌀밥 해물수제비국 참나물 유자샐러드 고구마맛탕 치밥소스 배추김치 바나나
790,오므라이스 우동국물 허브가들어간소시지 배추김치 용가리치킨 머스터드 짜먹는요구르트
791,하이라이스 찹쌀밥 크림빵 유부김가루국 단무지쪽파무침 채소고기말이 깍두기 플리또
792,쥐눈이콩밥 쇠고기부추영양탕 땅콩쌈장 호박깻잎감자전 샤브고추장불고기 상추쌈 배추김치 파프리카스틱 아삭이고추
793,불닭마요덮밥 쇠고기무국 숙주나물무침 깍두기 찹쌀쫀도그 식혜
794,찹쌀밥 얼큰콩나물국 캐슈넛마늘멸치볶음 오리훈제단호박볶음 배추김치 오렌지주스 애플파이
795,찰옥수수밥 건새우아욱감자된장국 탕평채 고구마건포도샐러드 김치치즈함박스테이크 깍두기
796,미니충무김밥 잔치국수 찐옥수수 오징어초무침 배추김치 바나나
797,찹쌀밥 우리찹쌀초코롤 동태쑥갓탕 미트볼떡조림 스크램블드에그 배추김치 바나나우유
798,찰보리밥 쫄면채소무침 들깨무채국 알배기배추 쌈장 수육 새우젓 보쌈김치 배
799,찹쌀밥 들깨수제비국 매운돼지갈비찜 양파장아찌 마카로니콘치즈구이 배추김치
800,찹쌀밥 쇠고기미역국 베이컨감자채볶음 한입돈까스 배추김치 혼합시리얼 흰우유
801,찰보리밥 열무해물된장국 고구마닭갈비 김치메밀전병 동그랑땡 석박지 상큼한사과주스
802,쇠고기콩나물밥 순두부백탕 순대야채볶음 소떡소떡꼬치 열무김치 엔요
803,찹쌀밥 감자다시마국 잔멸치땅콩조림 돼지불고기 배추김치 모닝빵 딸기잼 플리또
804,할맥밥 얼큰콩나물국 단무지쪽파무침 비름나물고추장무침 수제고르곤졸라아몬드피자토스 깍두기 플리또
805,찹쌀밥 미소된장국 오색피클 토마토스파게티 새우까스 배추김치
806,김자반찹쌀밥 머핀 팽이버섯미소장국 게맛살달걀찜 어묵매콤볶음 딸기두유
807,오므라이스 지단포함 유부김가루국 채소핫바 크리미양파S 배추김치 바나나 포도주스
808,흑미밥 우렁된장찌개 상추쌈 아삭이고추된장무침 한돈오븐구이 보쌈김치 카프리제토마토샐러드
809,찹쌀밥 허쉬쿠키 모듬어묵국 매콤콩나물무침 우리쌀깐쇼새우 열무김치 아이러브요거트
810,차조쌀밥 만두육개장 청포묵김무침 파닭 석박지 사과
811,찹쌀밥 돈육김치찌개 언양식바싹불고기 크링클컷 케첩 총각김치 조각파인애플
812,찹쌀밥 참치김치볶음 감자샐러드샌드위치 떡국 아몬호두파래돌김자반 후랑크소시지구이 케첩 상큼한사과주스
813,강황쌀밥 달콤한메세지케익 쇠고기미역국 매콤돼지갈비떡찜 곤드레나물잡채 배추김치 골드파인애플
814,찹쌀밥 조갯살미역국 부추양파무침 고구마맛탕 오리훈제구이 레몬무쌈 배추김치 바람떡
815,찹쌀밥 팔미어파이 김치가마보꼬어묵국 아몬드멸치볶음 마파두부 배추김치 베지밀
816,찰보리밥 모듬햄부대찌개 치커리사과무침 순대채소볶음 삼치데리야끼구이 총각김치
817,흑미밥 만두국 두부구이돈양념 고구마 크림치즈미트번 김치소 석박지 야쿠르트
818,찹쌀밥 감자버섯수제비국 쌈장찜닭 깍두기 김구이 플리또 메이플크림치즈파이
819,추가밥 자장면 달걀부추국 비름나물고추장무침 납작부침만두 배추김치 거봉
820,삼색소보로덮밥 청양초콩나물국 치즈떡 비엔나케첩볶음 깍두기 조각파인애플 프렌치토스트
821,달걀밥 붕어빵 맑은미역국 비엔나치즈떡볶음 배추김치 딸기우유
822,흑미밥 버섯청국장찌개 도토리묵채소무침 고구마닭갈비 햄감자채볶음 열무김치 플리또
823,찹쌀밥 부대찌개 브로콜리초장 크리미어니언수제치킨 석박지 달콤배
824,찹쌀밥 떡국 숙주맛살무침 제육볶음 열무김치 아이러브요거트 콘시리얼바견과바
825,차조쌀밥 열무된장국 연탄오리불고기파채 비빔막국수 달걀 깍두기 수박
826,찹쌀밥 수제피자핫도그 등뼈감자탕 사태떡찜 파래김자반 석박지
827,찹쌀밥 딸품소 황도파인샐러드 키위D 돈까스 배추김치 딸기바나나라떼 옥수수수프
828,현미찹쌀밥 대패불고기 몽글순두부짬뽕탕 우엉쌈장 날치알달걀찜 상추 깻잎 열무김치
829,흑미밥 단배추된장국 콩나물무침 부추파절이 새송이 통마늘구이 돼지고기구이 보쌈김치 딸기우유
830,파인애플카레라이스 팽이버섯미소장국 닭봉구이 벌집감자튀김 깍두기 모닝퐁라떼
831,찰보리밥 등뼈우거지국 갈치어묵볶음 새송이 통마늘구이 석박지 김구이 참외
832,찹쌀밥 설렁탕 소면 진미채야채무침 순살가자미카레튀김 석박지 과일푸딩
833,깍두기참치볶음밥 대만샌드위치 맑은콩나물국 토네이도소시지구이 나박김치 엔요
834,찹쌀밥 수제미니소시지크라상 양송이크림스프 양상추샐러드 요거트 미트소스스파게티 배추김치 수제오이무피클
835,김밥볶음밥 구운김 미소된장국 양파장아찌 통등심돈까스 배추김치 짜먹는요구르트
836,찹쌀밥 황태감자달걀국 갈릭후레이크떡말이 석박지 혼합시리얼 흰우유 딸기아몬드
837,홍국쌀밥 쫄면채소무침 크림빵 참치김치찌개 돈육달걀장조림 열무김치
838,찹쌀밥 쇠고기육개장 계란찜 발사믹샐러드 파프리카잡채 석박지 딸기맛포켓팝콘
839,김자반찹쌀밥 로제푸실리파스타 두부김치국 바베큐닭다리살꼬치 비요뜨
840,햄채소볶음밥 짬뽕국물 배추김치 리얼통살생선가스 플리또
841,찹쌀밥 돈육김치찌개 감자버터구이 언양식바싹불고기 총각김치 조각파인애플
842,찹쌀밥 마들렌 시금치된장국 매콤진미채견과볶음 스팸구이 케첩 무말랭이김치 제주감귤주스
843,십삼곡밥 감자짜글이찌개 연두부찜 양념장 머위들깨볶음 벌집감자튀김 케첩 닭강정 배추김치 사과
844,흑미밥 우렁된장찌개 오향장육 골뱅이소면무침 보쌈김치 사과
845,찹쌀밥 닭곰탕 오이부추무침 새싹함박스테이크 깍두기 튼튼칼슘롤 바나나
846,찹쌀밥 두부담은찰도그롤 전통순대국 아삭이고추쌈장무침 국물떡볶이 석박지 포도주스
847,참치야채비빔밥 순두부백탕 김치피자탕수육 단무지무침 열무김치 사랑해사과C주스
848,추가밥 어묵우동 닭카레볶음 꼬들단무지 총각김치 청포도코코푸딩 허니버터아몬드
849,치킨마요덮밥 유부김치국 콩나물무침 열무김치 꿀떡 바람떡 빠삐코
850,하이라이스 김치콩나물국 토마토구슬치즈샐러드 양념닭강정 깍두기 모닝빵 딸기쨈
851,찹쌀밥 소면설렁탕 주먹완자전 올미트콤보피자 석박지 청포도사과주스
852,차수수밥 황태감자달걀국 탕평채 오리훈제채소볶음 된장깻잎찜 배추겉절이
853,찹쌀밥 시래기된장국 멸치견과류볶음 김치볶음김가루 계란후라이 스팸구이 갈비만두 딸기요플레
854,찹쌀밥 쇠고기두부탕국 매콤돼지갈비떡찜 아몬드멸치볶음 무말랭이김치 모닝빵 딸기잼 바나나우유
855,강황쌀밥 온두부 참치김치볶음 미트볼펜네조림 사골우거지된장국 도라지오이무침 골드파인애플
856,자율밥김자반 죽 쫄면야채무침 석박지 상큼한레몬에이드 약과 회오리감자
857,찹쌀밥 김치가마보꼬어묵국 초코몬드 응원리얼소시지바 머스터드 석박지 자장덮밥소스 혼합시리얼 흰우유
858,버섯카로틴쌀밥 모듬햄부대찌개 라면사리 꼬들무채장아찌 충무식오징어 어묵무침 달걀말이 깍두기 사케이요구르트
859,삼겹살김치볶음밥 인절미토스트 쇠고기미역국 감자채볶음 계란후라이 열무김치
860,찹쌀밥 쇠고기미역국 잔멸치깻잎조림 볶음김치 옛날소시지 케첩 호밀사과파이 아이러브요거트
861,추가밥 열무물냉면 골뱅이사과무침 수제채소튀김 석박지 수박
862,찹쌀밥 반반한핫도그 순대돼지고기국 아삭이고추된장무침 오징어김치전 보쌈김치 도시락김
863,찹쌀밥 우리밀허니카스테라 몽글순두부짬뽕탕 숙주맛살무침 치즈닭갈비 배추김치 거봉
864,오징어덮밥 미소미역된장국 배추겉절이 수제카레난치즈피자 청포도사과주스
865,자율밥김자반 우동 오색피클 떡볶이 김말이튀김 배추김치 얼린자두맛쥬시쿨
866,밥 김치볶음 소시지구이 김가루 건새우아욱감자된장국 자장떡볶이 깍두기 무지개떡 미숫가루
867,완두콩밥 양송이크림스프 무생채 순대채소볶음 치즈함박 달걀후라이 데미S 배추김치 수리취떡
868,찹쌀밥 두부고추장찌개 영양갈비찜 치즈계란찜 보쌈김치 로키로드쿠키
869,찹쌀밥 맑은콩나물국 오리훈제 찐만두 바나나우유 깻잎무쌈
870,흑미밥 순두부연포탕 안동찜닭넙적당면 오징어사과초무침 배추김치
871,찹쌀밥 떡국 우리밀오트크랜베리쿠키 돈육데리야끼구이 깍두기 초코우유
872,곤드레콩나물밥 양념간장 근대된장국 황도파인샐러드 요거트애플D 수제김치피자탕수육 김구이 열무김치
873,찹쌀밥 참치김치찌개 찹스테이크감자조림 탕평채 열무김치 막대아이스크림
874,삼겹살김치볶음밥 팽이버섯미소장국 달걀후라이 응원리얼소시지바 머스터드 나박김치 상큼한사과주스 콘시리얼바견과바
875,혼합십곡밥 동태쑥갓탕 토마토파프리카무침 돈육버섯고추장불고기 배추김치 엔요 마카로니콘치즈구이
876,흑미밥 건새우무국 비빔막국수 순살닭갈비 수제고구마튀김 레몬무쌈 백김치
877,찹쌀밥 우리찹쌀초코롤 오징어무국 김치닭살볶음 무말랭이김치 시원해유
878,혼합십곡밥 달걀부추국 마파어두부덮밥소스 배추김치 초코설기 수제치킨퀘사디아 수박
879,자장덮밥 짬뽕국 의성마늘 갈비 롤만두 오이도라지무침 배추김치 바나나
880,찹쌀밥 딸기크림도지마롤 참치김치찌개 달걀장조림 스팸구이 케첩 복숭아음료
881,찰보리밥 쫄면채소무침 등뼈우거지국 가자미살빵가루튀김 깍두기 엔요
882,김가루밥 열무물냉면 닭장각오븐구이 깍두기 조각파인애플
883,찹쌀밥 황태감자달걀국 연탄오리불고기 파채 깻잎 볶음김치 허쉬드링크초콜렛 김구이
884,완두콩밥 로제크림소스스파게티 열무해물된장국 매콤돼지갈비떡찜 시금치옥수수알무침 배추김치 골드파인애플
885,흑미밥 들깨수제비국 순대야채볶음 햄야채계란말이 배추김치 수박
886,찹쌀밥 대만샌드위치 찐만두 깍두기 자장덮밥소스 스위트플럼주스
887,강황쌀밥 칼슘우리밀초코조각케익 쇠고기미역국 꼬들무채장아찌 떡잡채 돈육버섯고추장불고기 깍두기
888,찹쌀밥 부대찌개 찹쌀콩멸치볶음 돈육메추리알장조림 파래김자반 석박지 엔요
889,달걀밥 호박잎감자된장국 옛날소시지 케첩 모닝빵 딸기잼 비요뜨
890,찰보리밥 메기주꾸미쑥갓탕 진미채견과볶음 치커리사과무침 수제김치함박스테이크 나박김치 상큼한사과주스
891,흑미밥 쇠고기무국 연두부찜 콩나물무침 치즈불닭 깍두기 양념장
892,카레새우볶음밥 미소미역된장국 돈까스 총각김치 딸기우유 콘시리얼바견과바
893,김밥멸치주먹밥 모듬꼬치어묵국 매콤허니콤보 석박지 자두
894,흑미밥 건새우무국 토마토구슬치즈샐러드 미나리무생채 새송이 통마늘구이 한돈소금구이 보쌈김치
895,삼겹살김치볶음밥 링츄러스 맑은콩나물국 닭봉소금구이 총각김치 짜요짜요
896,현미찹쌀밥 근대콩나물된장국 연탄오리불고기 파채 깻잎 저염고등어카레구이 열무김치 바나나
897,비빔밥 팽이버섯된장국 치즈떡 비엔나케첩볶음 계란후라이 배추김치 워터멜론에이드
898,찹쌀밥 소면설렁탕 베이컨감자채볶음 달걀말이 석박지 후룻볼
899,추가밥 자장면 짬뽕국 꼬들단무지무침 배추김치 오렌지주스 치즈소시지핫도그
900,찹쌀밥 차승원표닭곰탕 당면사리 토마토소스등갈비구이 고구마맛탕 석박지 빠삐코
901,파인애플카레라이스 팽이버섯미소장국 초코몬드 치킨브리또 깍두기 쁘띠첼
902,강황쌀밥 호박잎감자된장국 돈육달걀장조림 양념깻잎지 망고토마토샐러드 키위D 해물우동볶음 배추겉절이
903,흑미밥 등뼈감자탕 계란찜 온두부 참치김치볶음 석박지 천사채샐러드
904,찹쌀밥 떡국 임실고구마치즈롤 감자채햄볶음 비엔나치즈떡볶음 깍두기 에이요요구르트
905,기장쌀밥 소면설렁탕 아삭이고추쌈장무침 삼색묵김무침 오징어김치전 석박지 수박
906,쇠고기콩나물밥 탕수육 생김구이 꼬치없는 떡꼬치 두부김치국 열무김치 양념장
907,찹쌀밥 우리밀허니카스테라 어묵김치볶음 수제언양식숯불고기 메론두유 김구이
908,산채비빔밥 우렁감자된장찌개 한우약고추장 달걀후라이 라이스틱 배추겉절이 제주감귤주스
909,닭갈비비빔밥 콩가루배추국 명엽채볶음 오꼬노미야끼 깍두기 조각파인애플
910,오므라이스 지단포함 우리밀우리쌀초코파이 두부김치국 치킨너겟 머스터드 깍두기 위편한구트
911,기장쌀밥 전복닭장각삼계탕 콩나물부추무침 순대채소볶음 깍두기 메로나튜브
912,찹쌀밥 잔치국수 한돈수육 무말랭이김치 레몬무쌈 보쌈김치 뽕따
913,찹쌀밥 김자반 죽 바베큐닭다리살꼬치 깍두기 길거리토스트 워터젤리
914,홍국쌀밥 참치김치찌개 황도파인샐러드 키위D 통등심돈까스 모듬채소피클 엔요 옥수수버터구이 어니언시즈닝
915,햄치즈밥버거 떡국 크링클컷 케첩 깍두기 짜먹는요구르트 우리쌀 크런치 찹쌀떡
916,찹쌀밥 카카오크런치뚱카롱 아욱수제비국 오리훈제 스크램블드에그 보쌈김치 사케이요구르트
917,차조쌀밥 김치가마보꼬어묵국 우렁쌈장 오향장육 석류무쌈 상추부추겉절이 새송이 통마늘구이 무말랭이김치 골드파인애플
918,참치야채비빔밥 어묵국 통곡물뮤즐리멸치볶음 크리미어니언수제치킨 백김치 딸기우유
919,찹쌀밥 티라미수케이크 몽글순두부짬뽕탕 뱅어포구이 수제등갈비구이 총각김치 바나나라떼
920,찹쌀밥 대패불고기채소덮밥소스
921,카레라이스 우동국물 통살새우까스 깍두기 무말랭이김치 초록마을 부드러운와플
922,찹쌀밥 들깨수제비국 마파두부 까르보나라쌀스파게티 꼬들단무지 튼튼칼슘롤 딸기바나나라떼
923,오므라이스 지단포함 얼큰콩나물국 닭봉구이 양념반달감자튀김 석박지 수박
924,셀프김밥 미소된장국 오리훈제구이 머스터드 깍두기 명과수정과
925,찹쌀밥 육개장 갈비왕교자 스팸구이 열무김치 바나나핫케익 딸기쨈 골드파인애플
926,쥐눈이콩밥 미트볼펜네조림 쇠고기부추영양탕 골뱅이무침 소면 꽈리고추멸치볶음 총각김치 바나나
927,찹쌀밥 죽 쫄면야채무침 통등심돈까스 깍두기 오렌지주스
928,밥 김치볶음 소시지구이 김가루 마들렌 열무된장국 달걀후라이 치즈스틱 케첩 플리또
929,찰옥수수밥 동태쑥갓탕 녹차고추냉이무쌈 사각어묵볶음 돈오븐구이 보쌈김치
930,찹쌀밥 모닝빵감자샌드위치 설렁탕 소면 치커리사과무침 소떡소떡꼬치 석박지
931,찹쌀밥 떡만두국 돈육메추리알장조림 멸치고추장볶음 석박지 아이러브요거트
932,마크니카레소스덮밥 우동국물 취나물무침 깍두기 리얼통살생선가스 멜론
933, 죽 불고기바게트샌드위치 진미채야채무침 석박지 포카리스웨트 무지개떡g
934,죽 삶은달걀 배추김치 플리또 에그타르트 혼합시리얼 
935,현미찹쌀밥 두부호박된장국 치즈닭갈비 김치단무지어묵잡채 열무김치 에이요요구르트
936,찹쌀밥 쇠고기미역국 매운돼지갈비찜 감자채볶음 배추김치 과일샐러드
937,카레새우볶음밥 아욱감자된장국 소보로치킨텐더 머스터드 무말랭이김치 딸기두유 스마일약과
938,햄채소볶음밥 표고미역국 달걀후라이 소보로회오리감자튀김 배추겉절이 수박 꿀떡
939,도토리묵국 찹쌀밥 파프리카잡채 부추파절이 제육볶음 깍두기 상하목장 유기농 요구르트
940,찹쌀밥 한방한우갈비탕 두부조림 콩나물부추무침 깍두기 딸기아이스찰떡 곡물그대로
941,흑미밥 부대찌개 비빔막국수 달걀 수제언양식숯불고기 어린잎샐러 깍두기 오렌지
942,김밥볶음밥 구운김 바지락콩나물국 삶은달걀 궁중떡볶이 배추김치 올때 메로나 튜브
943,깍두기스팸볶음밥 달걀후라이 콤비네이션 카카오크런치뚱카롱 미소미역된장국 동치미 시원해유
944,추가밥 잔치국수 감자핫도그 저염오이지무침 김치볶음 설레임
945,찹쌀밥 블루베리머핀 얼큰콩나물국 연탄오리불고기 파채 깻잎 사각어묵볶음 배추겉절이 복숭아음료
946,차조쌀밥 참치김치찌개 오향장육 석류무쌈 상추부추겉절이 새송이 통마늘구이 보쌈김치
947,찹쌀밥 떡국 크리미어니언수제치킨 깍두기 연두부찜 양념장 엔요
948,찹쌀밥 달걀찜 등심마니카츠 크림커리 모듬채소피클 달고나치즈아이스케이크 옥수수수프
949,찰보리밥 부대찌개 순대채소볶음 가자미살빵가루튀김 깍두기 에이요요구르트
950,현미찹쌀밥 설렁탕 면사리 치즈불닭 크링클컷 케첩 석박지 식혜
951,대패불고기채소덮밥 미소미역된장국 새우쏙쏙가마보꼬스틱 아몬드멸치볶음 핑크보스톤 석박지
952,오징어덮밥 달걀부추국 배추김치 치즈소시지핫도그 곡물그대로 거봉
953,카레라이스 통살새우까스 깍두기 수제모닝빵 딸기쨈 수박과일화채
954,찹쌀밥 김자반 햄치즈샌드위치 황태감자달걀국 매콤돼지갈비떡찜 무말랭이김치 가나초콜렛우유
955,강황쌀밥 육개장 삼색묵김무침 수제언양식숯불고기 어린잎샐러 석박지 플리또
956,차조밥 순두부백탕 햄야채계란말이 한돈오븐구이 레몬무쌈 배추김치 청포도후레쉬
957,찹쌀밥 우리밀우리쌀초코파이 감자버섯수제비국 마파두부 닭다리살꼬치 배추겉절이 딸기우유
958,혼합십곡밥 근대콩나물된장국 닭갈비 옛날소세지전 열무김치 골드파인애플
959,김밥멸치주먹밥 우동한그릇 깍두기 찹쌀쫀도그 케첩 포도푸딩
960,찹쌀밥 김자반 죽 콤비네이션 진미채엿장조림 깍두기 바나나우유
961,흑미밥 온두부 참치김치볶음 쇠고기버섯무국 수제매콤떡갈비 무말랭이무침 수박
