,요리명
0,찹쌀밥 소프트치즈케익 참치김치찌개 계란후라이 스팸구이 김구이 텐저린
1,잡곡밥 얼큰어묵국 상추쑥갓겉절이 돈육고추장오븐구이 배추김치 귤 꿀설기
2,스팸마요덮밥 바나나미니도넛 유부된장국 포도발효초음료
3,찹쌀밥 브라우니 애호박고추장찌개 상추부추겉절이 김치 돼지불고기 프로바이오틱
4,현미밥 두부김치국 양상추샐러드 치즈돈까스 감자튀김 배추김치 요구르트
5,찹쌀밥 들깨감자수제비 등뼈사태찜 어묵매콤볶음 깍두기 요구르트
6,찹쌀밥 붕어빵 쇠고기미역국 연두부찜 양념장 야채소시지 케첩 배추김치 귤
7,기장밥 등뼈감자탕 매콤콩나물무침 고소참치야채전 어묵메추리알장조림 배추김치 사과
8,찹쌀밥 얼큰콩나물국 무생채 옛날소세지전 오지치즈후라이 총각김치
9,찹쌀밥 초코칩 트위스트 두부김치국 깻잎양념찜 제육고추장볶음 텐저린
10,한그릇어묵우동 밥 파래돌김자반 라비올리만두 배추김치 유기농요구르트
11,찹쌀밥 쫄면야채무침 호박두부된장국 왕돈까스 백김치 고칼슘지방제로 플레인요구르트
12,찹쌀밥 쇠고기무국 매운돼지갈비찜 파래돌김자반 피칸파이 프로바이오틱
13,김치볶음밥 계란파국 깐풍기 총각김치 더블업요구르트
14,찹쌀밥 북어무채국 제육볶음 배추겉절이 플레오요구르트 깻잎쌈 쌈장
15,찹쌀밥 핫케이크 시금치콩나물국 닭살고추장볶음 마른김구이와 양념장 더블업 요구르트
16,찹쌀밥 소면설렁탕 비엔나메추리알조림 깻잎양념찜 김치전 귤
17,찹쌀밥 아욱된장국 호박느타리볶음 동그랑땡전 석박지 딸기요플레
18,찹쌀밥 감자고추장찌개 근대나물 김치 베이컨채소구이 유기농요구르트 에그타르트
19,찹쌀밥 팽이버섯된장국 참나물무생채 닭떡볶이 고추잡채김말이 배추김치
20,떡갈비볶음밥 시금치콩나물국 멸치고추장볶음 고감콘크로켓 열무김치
21,찹쌀밥 쇠고기당면국 연두부계란찜 제육구이 브라우니 텐저린
22,콩나물밥 양념장 들깨무채국 야채튀김 배추김치 골드키위쥬스
23,찹쌀밥 도토리수제비 영양갈비찜 얼갈이된장나물 청포묵김무침 석박지
24,찹쌀밥 소프트치즈케익 순두부김치국 계란후라이 스팸구이 김구이 엔요
25,자장잡채밥 부추계란국 만두탕수 배추김치 엔요
26,찹쌀밥 들기름바사삭김 청국장 소면야채무침 언양식바싹불고기 깍두기
27,찹쌀밥 감자수제비국 미역줄기볶음 두반장불닭볶음 감귤쥬스 아몬드파이
28,치킨마요덮밥 얼큰콩나물국 사과무생채 귤 핫도그 케첩
29,찹쌀밥 동태찌개 닭떡볶이 허브잡채말이 배추김치
30,죽 돈육장조림 파래돌김자반 배추김치 우유 시리얼 첵스
31,잔치국수 밥 배추김치 엔요 아몬드파이
32,찹쌀밥 시금치된장국 달걀꽈리고추장조림 사과무생채 미트소스스파게티 배추김치
33,찹쌀밥 떡만두국 김치돼지갈비찜 아몬드호두김자반 딸기우유 모닝빵 딸기잼
34,찹쌀밥 부대찌개 상추쑥갓겉절이 메추리알장조림 유기농요구르트 생크림모찌
35,찹쌀밥 얼큰콩나물국 삼치엿장조림 깻잎양념찜 배추김치
36,찹쌀밥 쇠고기무국 감자채볶음 치즈불닭 초코우유 카카오머핀
37,잔치국수 밥 과일샐러드 키위드레싱 꽈리고추멸치볶음 깐풍기 배추김치
38,옥수수계란찜 찹쌀밥 돈육김치찌개 배추나물무침 언양식바싹불고기 석박지
39,찹쌀밥 얼갈이배추된장국 시금치무침 제육구이 우리밀도넛 더블업 
40,찹쌀밥 닭개장 떡볶이 미역줄기볶음 배추김치 파인애플쥬스 순대 김치
41,참치김치덮밥 호박두부된장국 사과무생채 쥬시쿨 라면땅핫도그
42,찹쌀밥 초코칩 트위스트 갈비김치찌개 파래돌김자반 야채계란말이 프로바이오틱
43,자장밥 부추계란국 단무지쪽파무침 김피탕 귤 고구마설기
44,찹쌀밥 북어콩나물국 실곤약비빔면 돼지불고기 백김치 사케이요구르트
45,찹쌀밥 애호박우렁된장국 안동찜닭 김치참치볶음 텐저린 에그타르트
46,찹쌀밥 얼큰어묵국 상추쑥갓겉절이 제육김치볶음 고추장떡 깍두기
47,찹쌀밥 근대된장국 고추장떡볶이 고추잡채김말이 석박지 부추겉절이
48,찹쌀밥 소프트치즈케익 두부청국장 계란후라이 스팸구이 김구이 배추김치 귤
49,찹쌀밥 미트소스스파게티 잔멸치고추장무침 매콤닭꼬치 총각김치 옥수수스프 마늘빵 
50,찹쌀밥 붕어빵 쇠고기미역국 잔멸치아몬드볶음 비엔나메추리알조림 배추김치 텐저린
51,흑미기장밥 별별브라우니 양상추샐러드 감자튀김 케첩 고구마치즈돈까스 배추김치 옥수수스프
52,찹쌀밥 북어무채국 느티리버섯볶음 당면불고기 플레오요구르트 깻잎쌈 쌈장
53,찹쌀밥 소프트치즈케익 얼큰콩나물국 열무된장무침 치즈불닭 엔요
54,찰보리밥 등뼈감자탕 깻잎양념찜 고추장떡볶이 치킨텐더 머스터드 총각김치
55,찹쌀밥 자장우동 아욱수제비된장국 단무지무침 메추리알감자조림 배추김치
56,찹쌀밥 조랭이떡만두국 근대나물 김치 제육구이 피칸파이 프로바이오틱
57,잔치국수 추가밥 배추김치 귤 바람떡 핫도그케첩
58,찹쌀밥 비빔국수 계란만두국 숙주맛살무침 삼치구이 배추겉절이
59,찹쌀밥 쇠고기당면국 명엽채고추장무침 베이컨채소구이 유기농요구르트 에그타르트
60,김밥 꼬치어묵국 유채나물 배추김치 포도쥬스
61,찹쌀밥 등뼈감자탕 마늘쫑어묵볶음 오리불고기 깻잎쌈 깍두기
62,찹쌀밥 초코칩 트위스트 어묵고추장찌개 상추쑥갓겉절이 버섯제육볶음 귤
63,흑미밥 떡국 김치등뼈사태찜 사과무생채 베이컨감자채볶음 석박지
64,찹쌀밥 버섯들깨탕 중국만두 상추쌈 춘천닭갈비 배추김치
65,찹쌀밥 쇠고기우거지국 오리훈제채소볶음 배추김치 딸기우유 모닝빵 딸기잼
66,카레라이스 붕어빵 두부김치국 카바노치소시지 프로바이오틱
67,찹쌀밥 감자다시마국 매콤콩나물무침 자장떡볶이 스마일감자튀김 배추김치
68,찹쌀밥 어묵김치국 돈육메추리알조림 파래돌김자반 우유 시리얼 후르트링
69,김치볶음밥 순두부김치국 계란후라이 엔요 어묵꼬치
70,찹쌀밥 북어계란국 멘츠카츠 배추김치 레몬에이드 꽃맛살샐러드
71,찹쌀밥 참치김치찌개 안동찜닭 배추나물무침 허니버터갈릭 더블업 요구르트
72,계란밥 찹쌀새알미역국 쌈배추 쌈장 고구마피자 배추김치
73,찹쌀밥 바나나미니도넛 배추된장국 날치알계란말이 배추김치 김소떡
74,찹쌀밥 쇠고기무국 유채나물 두반장불닭볶음 생크림모찌 텐저린
75,흑미밥 꼬치어묵국 쌈배추 쌈장 돼지불고기 오지치즈후라이 배추김치
76,찹쌀밥 시금치콩나물국 돈육메추리알조림 비빔막국수 배추김치
77,찹쌀밥 돈육고추장찌개 쥐취포조림 베이컨채소볶음 에그타르트 포도쥬스
78,현미밥 떡국 셀프베지치킨샌드위치 꽈리고추멸치볶음 배추김치 귤
79,찹쌀밥 감자미역국 두부양념조림 브로콜리 초장 돈육떡강정 배추김치
80,찹쌀밥 북어채달걀국 멸치풋고추조림 야채소시지 케첩 배추김치 콘푸레이크 오레오오즈 우유만쥬
81,참치야채비빔밥 들깨무채국 야채튀김 배추김치 쥬스
82,찹쌀밥 두부콩나물국 건파래무침 스위트콘샐러드 돈까스만두 석박지
83,찹쌀밥 미니크림치즈프레즐 고추장찌개 오리훈제 부추무침 볼어묵조림 프로바이오틱
84,순대국밥 소떡소떡꼬치 부추겉절이 석박지 바나나
85,찹쌀밥 순두부김치국 계란후라이 스팸구이 케첩 애플파이 텐저린
86,쌀밥 잔치국수 밥 파래돌김자반 매콤닭꼬치 배추김치 귤
87,찹쌀밥 바지락미역국 상추쌈 아삭이고추된장무침 꽈리고추멸치볶음 콩나물불고기 배추김치
88,찹쌀밥 아욱콩나물국 진미채오이무침 김치 매콤닭불구이 감귤쥬스 카카오머핀
89,찹쌀밥 등뼈감자탕 과일샐러드 치즈돈까스 배추김치
90,찹쌀밥 순두부김치국 오이깍둑무침 불닭 떡갈비 석박지 쥬시쿨
91,찹쌀밥 배추된장국 오리훈제 부추무침 명엽채엿장볶음 우유 시리얼 첵스
92,찹쌀밥 부대찌개 돈육메추리알조림 상추겉절이 우리밀와플 생크림 과일음료
93,찹쌀밥 팽이버섯된장국 청포묵김무침 삼치데리야끼조림 배추김치
94,찹쌀밥 쇠고기버섯찌개 비타민나물 스팸김치볶음 두부 유기농요구르트 생크림모찌
95,찹쌀밥 감자미역국 매운갈비찜 파프리카잡채 김치 유기농요구르트 피자핫도그
96,찹쌀밥 순두부찌개 안동찜닭 근대나물 오징어김치전 백김치
97,찹쌀밥 조랭이떡만두국 프랑크계란말이 파래김과양념장 모닝빵 딸기잼 텐저린
98,차수수밥 순두부찌개 안동찜닭 새송이어묵볶음 배추김치 사과
99,찹쌀밥 열무된장국 영양계란찜 깐풍기 배추겉절이
100,찹쌀밥 아욱콩나물국 유채나물 김치 치즈불닭 우리밀도넛 더블업 요구르트
101,찹쌀밥 닭곰탕 깻잎양념찜 비엔나브로콜리볶음 삼치구이 사과
102,찹쌀밥 북어콩나물국 사태떡찜 숙주나물무침 볼어묵볶음 배추김치
103,찹쌀밥 소프트치즈케익 냉이된장국 미역줄기볶음 제육구이 프로바이오틱
104,찹쌀밥 버섯육개장 두부쑥갓무침 닭떡볶이 순대 김치
105,찹쌀밥 삼색수제비국 연근메추리알조림 양배추쌈 쌈장 돼지불고기 깍두기
106,찹쌀밥 쇠고기당면국 새발나물 김치 베이컨채소구이 엔요 후렌치토스트
107,찹쌀밥 두부달래된장찌개 상추겉절이 김치 돈육고추장오븐구이 귤
108,찹쌀밥 오징어무국 오리불고기 깻잎쌈 무말랭이무침 부추전 배추김치
109,찹쌀밥 쇠고기미역국 진미채엿장조림 고구마닭갈비 유기농찰링도너츠 배추김치 세종요구르트
110,치킨마요덮밥 무채맑은국 배추김치 회오리감자 내사랑사과쥬스
111,찹쌀밥 시금치바지락살된장국 돈등뼈김치찜 매실양념깻잎 새송이버섯볶음 화인쿨
112,찹쌀밥 계란만두국 파래돌김자반 김치 제육고추장볶음 딸기우유 모닝빵 딸기잼
113,김치삼겹볶음밥 표고부추계란국 아몬드호두김자반 매콤닭꼬치 배추겉절이 마시는샐러드
114,찹쌀밥 어묵무국 계란장조림 매운미트볼떡볶음 배추김치
115,찹쌀밥 북어콩나물국 아몬드멸치볶음 돈육김치볶음 두부 유기농요구르트 김 우리밀와플 생크림
116,찹쌀밥 닭곰탕 시금치무침 찐왕만두 양념장 석박지 똑똑한시리얼바 과일쥬스
117,찹쌀밥 감자다시마국 고등어무조림 비엔나브로콜리볶음 배추김치 포도발효초음료
118,찹쌀밥 쇠고기무국 건새우고추장볶음 옛날소세지전 텐저린 카카오머핀
119,토스트피자 순대국밥 부추겉절이 석박지 바나나
120,찹쌀밥 얼갈이배추된장국 매운갈비찜 매콤콩나물무침 부추잡채 깍두기
121,찹쌀밥 근대고추장무침 초코칩 트위스트 두부김치국 제육구이 프로바이오틱
122, 무채맑은국 해물우동볶음 카바노치소시지 머스터드 배추김치 쥬시쿨 자두
123,찹쌀밥 두부김치국 코다리무조림 도토리묵야채무침 석박지 요거타임
124,찹쌀밥 생크림카스테라 시금치콩나물국 깻잎양념찜 닭살고추장볶음 더블업 요구르트
125,자반주먹밥 유부된장국 고추장떡볶이 매콤당면김말이 단무지 파인애플쥬스
126,찹쌀밥 아욱된장국 중국만두 사과무생채 고구마닭갈비 배추김치 바나나라떼
127,찹쌀밥 붕어빵 쇠고기무국 김치참치볶음 치즈비엔나떡볶이 감귤쥬스
128,찹쌀밥 북어콩나물국 계란후라이 스팸구이 케첩 배추김치 맛김 바닐라크라운파이 텐저린
129,곡쌀밥 들깨미역국 오리훈제단호박볶음 오징어김치전 배추김치 파인애플 맛김구이 파프리카 아삭고추 땅콩쌈장
130,찹쌀밥 얼큰어묵국 도토리묵김치무침 가자미크런치까스 깍두기 내사랑사과쥬스
131,찹쌀밥 설렁탕 고소김무침 돈육김치볶음 두부 배추김치 콘푸레이크 그래놀라 황금복돼지뚱카롱
132,클로렐라밥 푸실리크림파스타 냉이된장국 하와이언그릴스테이크 딥브라운 배추김치 모닝빵 딸기잼
133,찹쌀밥 들깨감자수제비 상추겉절이 부추잡채 제육볶음 총각김치
134,찹쌀밥 우리쌀돼지바나나링카스테라 조랭이떡만두국 진미채엿장조림 오색현미육원전 허니버터아몬드 사과
135,봄나물비빔밥 유부보쌈꼬치어묵국 오이깍둑무침 후라이드반양념반 배추김치 바나나 대구꿀떡
136,찹쌀밥 순대국밥 마늘쫑어묵볶음 부추전 석박지 그릭요거트
137,찹쌀밥 두부콩나물국 맛살미역줄기볶음 돈육두루치기 배추김치 에그타르트 콘푸레이크 초코첵스
138,녹차카테킨밥 떡국 간장돼지갈비찜 골빔면 황도샐러드 드레싱 깍두기 봄동겉절이
139,찹쌀밥 열무된장국 숙주나물무침 훈제오리샐러드 오지치즈후라이 배추김치
140,찹쌀밥 북어채달걀국 멸치풋고추조림 야채소시지 케첩 배추김치 콘푸레이크 오레오오즈 우유만쥬
141,흑미밥 등뼈우거지국 납작군만두 비빔야채 햄감자채볶음 배추김치 상큼아삭사과
142,찹쌀밥 쫄면야채무침 청국장 삼치엿장조림 상추부추겉절이 배추겉절이
143,찹쌀밥 쇠고기미역국 콩나물무침 고구마닭갈비 바바리안두부도너츠 배추김치 세종요구르트
144,현미밥 떡국 셀프베지치킨샌드위치 꽈리고추멸치볶음 배추김치 귤 쿠키
145,찹쌀밥 계란만두국 제육볶음 열무김치 미니파인애플 깻잎쌈 쌈장
146,찹쌀밥 쿠키스타일 핫케이크 건새우아욱국 콩나물불고기 감자채볶음 깻잎김치 콘푸레이크 스페셜K
147,찹쌀밥 부대찌개 쥐취포조림 미트볼데리야끼볶음 깍두기 요구르트 버터토스트 쨈
148,찹쌀밥 들기름바사삭김 얼큰콩나물국 고추장떡볶이 계란말이 깍두기
149,찹쌀밥 경상도고깃국 건파래무침 계란부추볶음 배추김치 딸기요플레 우리쌀크렌베리
150,기장밥 달래두부된장찌개 스크램블드에그 통통안심통강정 배추김치 상큼아삭사과
151,찹쌀밥 쇠고기육개장 청포묵김무침 돈육떡강정 배추김치 봄동겉절이
152,찹쌀밥 참치김치볶음 건새우아욱된장국 스팸구이 케첩 조미김 고칼슘지방제로 플레인요구르트 몬테디저트
153,토마토펜라이스업쌀밥 부대찌개 라면사리 두부조림 안동찜닭 양배추쌈 케일쌈 젓갈 깍두기 방울토마토
154,찹쌀밥 닭곰탕 양배추쌈 쌈장 오이부추무침 오삼불고기 열무김치
155,찹쌀밥 북어채무국 고구마닭갈비 부들어묵조림 깍두기 플라워파이 골드키위요플레
156,목살필라프 바지락쑥국 미나리오이무침 배추김치 수제치즈피자 바나나
157,찹쌀밥 떡국 오징어야채초무침 통등심돈까스 딸기요플레 총각김치
158,찹쌀밥 유학다녀온참붕어애플페스트리 연두부백탕 상추생채 비엔나떡볶음 배추김치 포도요거트
159,차수수밥 쇠고기미역국 잡채 돈오븐구이 깍두기 파프리카 아삭고추 땅콩쌈장 티라미스 생일축하해!!
160,찹쌀밥 비빔국수 시금치콩나물국 돈육메추리알조림 중국만두 플레오요구르트
161,찹쌀밥 건새우아욱된장국 오리훈제야채무침 파래돌김자반 배추김치 우리밀애플파이 과일쥬스
162,자장밥 오징어짬뽕국 레몬크림깐쇼새우 배추김치 수제과일음료
163,찹쌀밥 아욱된장국 느타리버섯맛살볶음 너비아니조림 배추김치 콘푸레이크 그래놀라 리얼수제딸기머핀
164,할맥밥 얼갈이배추된장국 돼지불고기 상추쌈 배추김치 마카로니콘치즈구이
165,찹쌀밥 삼색수제비국 비엔나메추리알조림 돼지사태김치찜 매콤콩나물무침 깍두기
166,쇠고기감자무국 찹쌀밥 진미채엿장조림 한입돈까스케첩 배추김치 요거타임 유기농초코찰링도넛
167,밤고구마밥 들깨무채국 연두부찜 양념장 닭장각오븐구이 배추김치 바나나
168,찹쌀밥 등뼈감자탕 양배추쌈 쌈장 순대야채볶음 오리훈제단호박볶음 배추김치
169,찹쌀밥 다시마무국 씨앗미트볼조림 무말랭이무침 배추김치 콘푸레이크 초코첵스 프렌치토스트
170,흑미밥 쫄면야채무침 파슬리슈니첼 브라운 깍두기 마늘빵 콘스프 과일쥬스
171,찹쌀밥 소면설렁탕 영양갈비찜 시금치무침 카레감자채볶음 배추겉절이
172,찹쌀밥 사골배추국 볼어묵조림 햄야채계란말이 배추김치 오렌지쥬스 현미시리얼바
173,강황쌀밥 떡국 오리불고기 깻잎쌈 새싹 양상추샐러드 드레싱 저염고등어구이 깍두기
174,찹쌀밥 닭개장 감자고추장조림 언양식바싹불고기 배추김치 봄동겉절이 매실음료
175,찹쌀밥 버터롤케이크 배추된장국 쥐포조림 돼지불고기 배추김치 비피더스
176,참치김치덮밥 북어콩나물국 시금치무침 타코야끼 깍두기 사과
177,찹쌀밥 건새우아욱된장국 비빔막국수 얼갈이된장나물 갈릭왕돈까스 석박지 플레오요구르트
178,찹쌀밥 얼큰콩나물국 돼지불고기 취나물볶음 딸기요플레 마늘빵
179,자반주먹밥 유부된장국 고추장떡볶이 코코넛새우튀김 단무지 파인애플쥬스
180,찹쌀밥 순두부찌개 상추겉절이 맛살미역줄기볶음 돈육버섯불고기 배추김치 미니파인애플
181,찹쌀밥 머핀 버섯된장찌개 닭볶음 베이컨감자채볶음 배추김치 포도 요플레 
182,잔치국수 밥 닭강정 열무김치 팔미어파이 사과C쥬스
183,찹쌀밥 떡국 계란장조림 돌나물무침 탕수육 배추김치
184,찹쌀밥 순두부김치국 미역줄기볶음 김치 불닭볶음 텐저린 우리밀허니카스테라
185,율무밥 민물새우수제비국 잔멸치땅콩조림 크리미어니언치킨 깻잎김치 파프리카샐러드 드레싱
186,찹쌀밥 오징어무국 오리불고기 깻잎쌈 근대나물 도토리묵김치무침 백김치
187,찹쌀밥 얼큰콩나물국 찐만두 양념간장 햄감자채볶음 배추김치 찹쌀모찌 과일쥬스
188,차조밥 호박두부된장국 장조림비빔면 순대깻순볶음 배추김치 컬리플라워 드레싱
189,찹쌀밥 쇠고기우거지국 코다리무조림 비엔나떡케찹조림 취나물볶음 배추김치 비피더스
190,찹쌀밥 미니크림치즈프레즐 고추장찌개 오리훈제 부추무침 볼어묵조림 프로바이오틱
191,차슈덮밥 꽃새우아욱된장국 화끈불어묵꼬치 배추김치 식혜
192,찹쌀밥 자장우동 유부어묵국 꽈리고추멸치볶음 깐풍기 깍두기
193,찹쌀밥 열무된장국 참나물무침 김치 제육구이 우리밀도넛 마시는샐러드
194,율무밥 소면설렁탕 꽁치김치찜 햄야채계란말이 석박지 맛김 바나나
195,참치김치덮밥 냉이된장국 단무지무침 감자튀김 소떡소떡 열무김치
196,찹쌀밥 팽이버섯된장국 쥐포채볶음 치킨데리야끼조림 배추김치 딸기요플레 우리밀와플 생크림
197,율무밥 물만두국 고추장떡볶이 김말이튀김 오징어링 배추김치 요구르트
198,찹쌀밥 오징어볶음 소면 쇠고기버섯찌개 비름나물고추장무침 꽃맛살샐러드 총각김치
199,찹쌀밥 핫케이크 달래두부된장찌개 볼어묵조림 치킨너겟 오렌지드링크
200, 초코칩 트위스트 무채맑은국 해물우동볶음 카바노치소시지 머스터드 배추김치 쥬시쿨 자두
201,찹쌀밥 쇠고기두부국 돼지사태김치찜 계란찜 시금치무침 배추김치
202,죽 밥 돈육꽈리고추장조림 아몬드호두김자반 배추김치 초코우유 밀크프랑스빵
203,김치볶음밥 계란파국 피자소세지빵 아몬드호두김자반 텐저린
204,찹쌀밥 피자바게트 달래두부된장찌개 실곤약비빔면 참나물겉절이 돼지불고기 배추김치
205,찹쌀밥 감자수제비국 진미채볶음 두반장불닭볶음 감귤쥬스 아몬드파이
206,팥밥 배추김치 생일케이크 
207,찹쌀밥 돈육김치찌개 찹스테이크감자조림 탕평채 석박지 뻥이요골드
208,찹쌀밥 롤케잌 애호박고추장찌개 오리훈제야채무침 계란후라이 김 무산김 사과한가득쥬스
209,홍국쌀밥 오만둥이된장찌개 양파간장초절임 돈오븐구이 배추김치 바나나 
210,찹쌀밥 쇠고기당면국 단호박견과류찜 통살새우까스 깍두기 방울토마토
211,찹쌀밥 모카번 두부김치국 파래돌김자반 제육볶음 총각김치 콘푸레이크 그래놀라
212,모듬꼬치어묵국 취나물밥양념간장 맥시칸타코 배추김치 과일쥬스
213,찹쌀밥 꽃게찌개 알감자버터구이 오이부추겉절이 찜닭 배추김치
214,찹쌀밥 초코칩 트위스트 쇠고기무국 계란장조림 연근조림 콘푸레이크 아몬드후레이크 사과
215,클로렐라밥 닭곰탕 양배추쌈 케일쌈 쌈장 황태채소소면무침 쭈꾸미왕만두양념장 깍두기
216,찹쌀밥 떡국 찹쌀콩멸치볶음 치커리들깨소스무침 김치치즈함박스테이크 깍두기
217,오므라이스 케첩 호박두부된장국 배추김치 허니버터아몬드 콘푸레이크 오레오오즈 초코파이
218,홍국쌀밥 등뼈우거지국 검은깨두부조림양념토핑 명란게살치즈카츠 배추김치 쑥떡
219,김밥볶음밥 구운김 조개콩나물국 삶은달걀 떡볶이 배추김치 단무지무침 최고야포도C주스
220,죽 깻잎찜 어묵메추리알장조림 배추김치 딸기요플레 치즈케이크
221,자반주먹밥 한그릇우동 치킨커틀릿머스타드 배추김치 포도쥬스
222,찹쌀밥 새알만두국 토마토소스등갈비구이 발사믹샐러드 석박지 엔요요구르트
223,찹쌀밥 북어콩나물국 쥐취포조림 야채소시지케첩 배추김치 콘푸레이크 초코첵스 우리밀와플 생크림
224,낙지콩나물비빔밥 배추김치 피자핫도그 요구르트
225,삼겹살김치덮밥 팽이버섯된장국 스크램블에그 새우튀김 김가루 깍두기 바나나
226,계란밥 순두부찌개 비엔나야채볶음 배추김치 오렌지쥬스 브라우니케잌
227,찰보리밥 참치김치찌개 파채겉절이 대패불고기 제철 연근튀김 나박김치
228,찹쌀밥 맑은콩나물국 쫄면야채무침 매운통등심돈까스 깍두기 깻잎김치
229,찹쌀밥 쇠고기우거지국 두부굴소스볶음 찐왕만두 배추김치 글레이즈드 과일쥬스
230,율무밥 나주곰탕당면 찰순대허브소금 자반고등어구이양념장 석박지 사과
231,김가루밥 떡국 통곡물뮤즐리멸치볶음 오징어김치전 석박지 허쉬초코우유
232,찹쌀밥 얼큰콩나물국 볼어묵조림 레몬향생선까스 배추김치 바나나우유 초코에끌레어
233,새싹힐링비빔밥 초고추장 강릉초당황태순두부찌개 소떡소떡꼬치 배추김치 요쿠르트 호두과자
234,카레라이스 소프트미니치즈케익 어묵김치국 숙주나물무침 양념닭강정 열무김치
235,찹쌀밥 고구마빅데니쉬 배추된장국 참치야채볶음 스팸구이 케첩 깍두기 콘푸레이크 아몬드후레이크
236,잡곡밥 우렁살아욱된장국 스웨디시미트볼 멸치견과류볶음 배추김치 파인애플
237,찹쌀밥 쇠고기육개장 어묵당면잡채 두부구이 석박지 양념장 청포도
238,찹쌀밥 딸기잼핫케이크 떡국 진미채엿장조림 등갈비조림 배추김치 오렌지쥬스
239,기장밥 버섯들깨탕 해물찜 간장마늘치킨 배추김치 
240,밥 잔치국수 찐옥수수 오징어초무침 배추김치 바나나
241,찹쌀밥 무채맑은국 오리훈제부추무침 배추김치 포도스무디 식빵토스트오렌지쨈
242,자반주먹밥 유부장국 계란떡볶이 매콤당면김말이 배추김치 능금쥬스
243,찹쌀밥 조갯살미역국 상추겉절이 양배추쌈 한돈맥적구이 보쌈김치 두부우렁쌈장
244,찹쌀밥 쇠고기무국 잔멸치깻잎찜 고구마닭갈비 모닝빵딸기잼 콘푸레이크 오레오오즈
245,찹쌀밥 소면설렁탕 참치두부조림 치즈돈까스 석박지 요플레
246,자장덮밥 계란파국 브로콜리오징어초장 배추김치 짜먹는요구르트 꼬물이만두
247,찹쌀밥 버터크로와상 호박된장국 스크램블드에그 케첩 콩나물불고기 배추김치 쵸코우유
248,강황쌀밥 떡국 닭봉윙조림 고소참치야채전 깍두기 
249,찹쌀밥 고추장짬뽕국 연두부찜 김피탕 깍두기 파인애플
